461,UgwMr1yelcwsX45ln-l4AaABAg,-8lGCTFGEJs,Moooooy boeno
462,Ugw_cg4yB-XRseL8bCR4AaABAg,-8lGCTFGEJs,me sirbio para la prueba  de hoy
463,UgyGI849186hlmeeIZp4AaABAg,-8lGCTFGEJs,me sirbio para la prueba  de hoy
464,UgwviC4DhT2fAqdaCjh4AaABAg,-8lGCTFGEJs,Don bosco?
465,Ugz_WRIda30wP4_Cp9V4AaABAg,-8lGCTFGEJs,Muy bien explicado me has ayudado mucho
466,Ugx6WkEQ7gCS_5Fwkll4AaABAg,-8lGCTFGEJs,Parecido al Abel y Caín
467,UgxcP8ZRT-3INMeQjYZ4AaABAg,-8lGCTFGEJs,por eso los argentinos somos asi..ajaajaj
468,UgyNjNLUiCKNROKnEZB4AaABAg,-8lGCTFGEJs,Soy el único que lo ve por gusto y no por un perro examen?
469,UgyNjNLUiCKNROKnEZB4AaABAg.8qYz-UTn1pA8zJr7N--Hav,UgyNjNLUiCKNROKnEZB4AaABAg,yo lo veo por tarea jaja
470,UgzQdmnAaPNRugNYeQR4AaABAg,-8lGCTFGEJs,Que liooo
471,UgwfwowE-E__oKRaYnR4AaABAg,-8lGCTFGEJs,Like si no sabias que tenias prueba mañana
472,UgzT5hTVyiHhKMd7FKd4AaABAg,-8lGCTFGEJs,Muchas gracias asi como te lo digo gracias
473,Ugwyu4DNmHMnMSq55i14AaABAg,-8lGCTFGEJs,El amor duele
474,Ugwyu4DNmHMnMSq55i14AaABAg.8nEes-Tcj0N9ifhRIUYIgp,Ugwyu4DNmHMnMSq55i14AaABAg,"sacarse un 1 igual, es lo que me saque con este video documental"
475,UgwDmhCsN32EV2_degJ4AaABAg,-8lGCTFGEJs,El amor durlr
476,UgyVhUiLJnReEb_cvqh4AaABAg,-8lGCTFGEJs,Si pones Roma y lo volteas dice amor
477,UgyVhUiLJnReEb_cvqh4AaABAg.8mX4sHIDWgQ9ifhNrHBLpi,UgyVhUiLJnReEb_cvqh4AaABAg,vaya dato perturbador.. aunque esta mas explicativo que el video.
478,UgxrgAjvW_QoOpzP0xh4AaABAg,-8lGCTFGEJs,Porfa sube la leyenda de Hercules
479,Ugw3k_boB-jS7_crCGp4AaABAg,-8lGCTFGEJs,Hola Hola eso me gustó a mi y a mis compañeros
480,UgzMqjw4FHlhFwoBxjx4AaABAg,-8lGCTFGEJs,estos videos son de la caca v:<
481,Ugz6fFVVmlzMf1BH4PZ4AaABAg,-8lGCTFGEJs,No weon
482,Ugz6fFVVmlzMf1BH4PZ4AaABAg.8klrZJnk2eU9ifi00NFgcB,Ugz6fFVVmlzMf1BH4PZ4AaABAg,amén hijo mio
483,Ugz6fFVVmlzMf1BH4PZ4AaABAg.8klrZJnk2eU8l19sAbDs02,Ugz6fFVVmlzMf1BH4PZ4AaABAg,"Hola!¡Qué bueno que te gusten nuestro videos!A partir de ahora, podrás acceder a toda la serie de “Exploradores de la Historia” por tan solo 7 dólares clickeando en el siguiente link: https://vimeo.com/astrolabmotion/vod_pagesEl contenido está completo y puedes optar por castellano o inglés!!El canal de YouTube quedará restringido sólo a algunos fragmentos de la serie. Cualquier cosa, nos comentas!Abrazos!!"
484,UgxOpENbYehbAsV9Cnt4AaABAg,-8lGCTFGEJs,Me ayudó muchísimo porque mañana tengo una prueba
485,UgxOpENbYehbAsV9Cnt4AaABAg.8kaKDN2v2kF8l1A2beQR64,UgxOpENbYehbAsV9Cnt4AaABAg,"Hola!¡Qué bueno que te gusten nuestro videos!A partir de ahora, podrás acceder a toda la serie de “Exploradores de la Historia” por tan solo 7 dólares clickeando en el siguiente link: https://vimeo.com/astrolabmotion/vod_pagesEl contenido está completo y puedes optar por castellano o inglés!!El canal de YouTube quedará restringido sólo a algunos fragmentos de la serie. Cualquier cosa, nos comentas!Abrazos!!"
486,UgykNXNjFJJVTPy2KWh4AaABAg,-8lGCTFGEJs,Wau
487,UgykNXNjFJJVTPy2KWh4AaABAg.8k--fTGiBjG8l1Q9BHdaPP,UgykNXNjFJJVTPy2KWh4AaABAg,"Hola!¡Qué bueno que te gusten nuestro videos!A partir de ahora, podrás acceder a toda la serie de “Exploradores de la Historia” por tan solo 7 dólares clickeando en el siguiente link: https://vimeo.com/astrolabmotion/vod_pagesEl contenido está completo y puedes optar por castellano o inglés!!El canal de YouTube quedará restringido sólo a algunos fragmentos de la serie. Cualquier cosa, nos comentas!Abrazos!!"
488,UgwXPYow7XzljAwN6E54AaABAg,-8lGCTFGEJs,OYE TU! SI TU EL QUE ESTA VIENDO ESTE COMENTARIO SUBE AHORA AH VER EL VIDEO Y PON ATENCION DEBES APRENDERTELO >:V
489,UgwXPYow7XzljAwN6E54AaABAg.8jrj_2EH8i49ifhoGFzCzC,UgwXPYow7XzljAwN6E54AaABAg,"No, es muy largo, me aburri por el minuto 56:30"
490,UgwXPYow7XzljAwN6E54AaABAg.8jrj_2EH8i48l1QEBhzKyC,UgwXPYow7XzljAwN6E54AaABAg,"Hola!¡Qué bueno que te gusten nuestro videos!A partir de ahora, podrás acceder a toda la serie de “Exploradores de la Historia” por tan solo 7 dólares clickeando en el siguiente link: https://vimeo.com/astrolabmotion/vod_pagesEl contenido está completo y puedes optar por castellano o inglés!!El canal de YouTube quedará restringido sólo a algunos fragmentos de la serie. Cualquier cosa, nos comentas!Abrazos!!"
491,Ugwf5PPXMPEZ_mHVHPN4AaABAg,-8lGCTFGEJs,Quien diría que Roma fue un bebé y que en su cadáver gigante se fundó la ciudad de roma  emoji_face_with_tears_of_joy  emoji_face_with_tears_of_joy (eso me dio a entender el video al principioXD)
492,Ugwf5PPXMPEZ_mHVHPN4AaABAg.8jhhY3H08qS8l1QLFUtKXx,Ugwf5PPXMPEZ_mHVHPN4AaABAg,"Hola!¡Qué bueno que te gusten nuestro videos!A partir de ahora, podrás acceder a toda la serie de “Exploradores de la Historia” por tan solo 7 dólares clickeando en el siguiente link: https://vimeo.com/astrolabmotion/vod_pagesEl contenido está completo y puedes optar por castellano o inglés!!El canal de YouTube quedará restringido sólo a algunos fragmentos de la serie. Cualquier cosa, nos comentas!Abrazos!!"
493,UgyX8BzmT6tHrH-lRWN4AaABAg,-8lGCTFGEJs,Me encanta . Sige asi  emoji_winking_face  emoji_winking_face  emoji_grinning_face_with_smiling_eyes  emoji_grinning_face_with_smiling_eyes  emoji_kissing_face_with_smiling_eyes  emoji_kissing_face_with_closed_eyes  emoji_kissing_face_with_smiling_eyes  emoji_kissing_face_with_closed_eyes  emoji_smiling_face_with_sunglasses  emoji_smiling_face_with_sunglasses  emoji_kissing_face_with_smiling_eyes  emoji_smiling_face_with_sunglasses  emoji_kissing_face_with_smiling_eyes  emoji_smiling_face_with_sunglasses  emoji_kissing_face_with_smiling_eyes  emoji_smiling_face_with_sunglasses  emoji_kissing_face_with_smiling_eyes 
494,UgyX8BzmT6tHrH-lRWN4AaABAg.8iVGqSxnv_x8l1RCnjxcvB,UgyX8BzmT6tHrH-lRWN4AaABAg,"Hola!¡Qué bueno que te gusten nuestro videos!A partir de ahora, podrás acceder a toda la serie de “Exploradores de la Historia” por tan solo 7 dólares clickeando en el siguiente link: https://vimeo.com/astrolabmotion/vod_pagesEl contenido está completo y puedes optar por castellano o inglés!!El canal de YouTube quedará restringido sólo a algunos fragmentos de la serie. Cualquier cosa, nos comentas!Abrazos!!"
495,UgxjmC5alUHwutnxbpl4AaABAg,-8lGCTFGEJs,me sirbe para el colegio
496,UgxjmC5alUHwutnxbpl4AaABAg.8hoOqAUt91Q8l1RYmEUkRD,UgxjmC5alUHwutnxbpl4AaABAg,"Hola!¡Qué bueno que te gusten nuestro videos!A partir de ahora, podrás acceder a toda la serie de “Exploradores de la Historia” por tan solo 7 dólares clickeando en el siguiente link: https://vimeo.com/astrolabmotion/vod_pagesEl contenido está completo y puedes optar por castellano o inglés!!El canal de YouTube quedará restringido sólo a algunos fragmentos de la serie. Cualquier cosa, nos comentas!Abrazos!!"
497,UgzL0LhOHSoK-N43Wjl4AaABAg,-8lGCTFGEJs,Estoy en un trabajo y esto me va a servir muuuchooo
498,UgzL0LhOHSoK-N43Wjl4AaABAg.8hEZD9MDSGz8zP12O9r_Di,UgzL0LhOHSoK-N43Wjl4AaABAg,@Astrolab Motion egtufujgyijhyuhgyjg
499,UgzL0LhOHSoK-N43Wjl4AaABAg.8hEZD9MDSGz8l1RtHYvPbh,UgzL0LhOHSoK-N43Wjl4AaABAg,"Hola!¡Qué bueno que te gusten nuestro videos!A partir de ahora, podrás acceder a toda la serie de “Exploradores de la Historia” por tan solo 7 dólares clickeando en el siguiente link: https://vimeo.com/astrolabmotion/vod_pagesEl contenido está completo y puedes optar por castellano o inglés!!El canal de YouTube quedará restringido sólo a algunos fragmentos de la serie. Cualquier cosa, nos comentas!Abrazos!!"
500,UgyjKkVnHSv34txzWj54AaABAg,-8lGCTFGEJs,grasias me sirvio de mucha ayuda x3
501,UgyjKkVnHSv34txzWj54AaABAg.8gy8DjX4UrX8l1S4Hwfy8u,UgyjKkVnHSv34txzWj54AaABAg,"Hola!¡Qué bueno que te gusten nuestro videos!A partir de ahora, podrás acceder a toda la serie de “Exploradores de la Historia” por tan solo 7 dólares clickeando en el siguiente link: https://vimeo.com/astrolabmotion/vod_pagesEl contenido está completo y puedes optar por castellano o inglés!!El canal de YouTube quedará restringido sólo a algunos fragmentos de la serie. Cualquier cosa, nos comentas!Abrazos!!"
502,Ugyn9ewFQiPdSxJqbQ14AaABAg,-8lGCTFGEJs,"Los amo, este es el examen de mañana.. PRIMER PRUEBA DE ROMA EN SEGUNDO AÑO"
503,UgxnN3setDQKij4b9xh4AaABAg,-8lGCTFGEJs,Donde puedo encontrar el video completo ?
504,UgyrDiPJoixbsbSL9wZ4AaABAg,-8lGCTFGEJs,BAH EZTO IO LLA LO ZABIA :v
505,UgxHlpdJziZtix4_xM14AaABAg,-8lGCTFGEJs,Dorgas
506,UgxHlpdJziZtix4_xM14AaABAg.8dG64wOOMVG8dNa2vXYqwL,UgxHlpdJziZtix4_xM14AaABAg,tu no tendras alug porrito no que esoty sin na
507,UgyFUPz1d4MgodQGwXd4AaABAg,-8lGCTFGEJs,Foto del rey de roma
508,UgzceCF2__tDdIFsdDR4AaABAg,-8lGCTFGEJs,xD ola k asegrax :V
509,UgzQ0PXEsKo-1aFPc6h4AaABAg,-8lGCTFGEJs,Olvidaste muchos detalles.
510,UgwoaFxzEvZF3R-dGVh4AaABAg,-8lGCTFGEJs,"Por fin escucho historia verdadera, fíjate que en mi país estan enseñando que el que fundo roma fue Cesar augusto.."
511,UgwL6C32z9TNd7p9MNR4AaABAg,-8lGCTFGEJs,Gracias me sirvió para mi examen y exposición;b
512,Ugx6YAj2Z8d3wjpXojt4AaABAg,-8lGCTFGEJs,JAJA aprobe mi examenn emoji_heart_suit Grcss emoji_upside-down_face 
513,UgyCuFpfT0LV3h7OhS14AaABAg,-8lGCTFGEJs,Tengo prueba
514,Ugw6wMawVARhOSop1fd4AaABAg,-8lGCTFGEJs,me va aserbir muchisimo emoji_beating_heart  emoji_beating_heart 
515,Ugw6wMawVARhOSop1fd4AaABAg.8_ChIbz0JrG9ifhUc5CGyh,Ugw6wMawVARhOSop1fd4AaABAg,ahora a ver un video de ortografía jiijij
516,Ugxq5ehXpjjN3wqPmu14AaABAg,-8lGCTFGEJs,gracias me sirbio y pase el examen
517,UgxwKaAugZg8uMGMjp94AaABAg,-8lGCTFGEJs,Me sirbe para la pruebe el martes gracias
518,UgyQkLyhR09lATJc2it4AaABAg,-8lGCTFGEJs,Me gusto tu esfuerzo
519,Ugx7g2uzOu98JT2dR-Z4AaABAg,-8lGCTFGEJs,Se repite siempre lo mismo no me gusta
520,UgxtRWIV5B6DiZ9vjbZ4AaABAg,-8lGCTFGEJs,me gusto emoji_face_with_tears_of_joy  emoji_face_with_tears_of_joy 
521,UgxxkYIvySSGzlHgEy54AaABAg,-8lGCTFGEJs,Like el que tiene prueba mañana
522,UgxxkYIvySSGzlHgEy54AaABAg.8ZU4mmCvniP9-TySf2JwsF,UgxxkYIvySSGzlHgEy54AaABAg,Yo
523,UgxxkYIvySSGzlHgEy54AaABAg.8ZU4mmCvniP8kOdorU-631,UgxxkYIvySSGzlHgEy54AaABAg,yo pasado mañana
524,UgzQTXdmfgCSxxbEGNV4AaABAg,-8lGCTFGEJs,"Tengo prueba mañana, profe Davis Sus vídeos me dan sueñooo"
525,Ugww7a8wAGW1V_soATd4AaABAg,-8lGCTFGEJs,No mamen el tio no lo abandonó si no que los queria matar para el quedarse en el reinado
526,UgzSmX0xA_NMEvVG_s54AaABAg,-8lGCTFGEJs,ahora se lo de roma
527,UgzC9wUNjueJhrEBfm54AaABAg,-8lGCTFGEJs,Buen video de risa
528,UgwfzDBZAt9e3cfsWlR4AaABAg,-8lGCTFGEJs,me sirvio mucho gracias
529,UgxKsNyE78mvpzxjl1Z4AaABAg,-8lGCTFGEJs,los mejores
530,UgwQgXzHT2xOxACLHb94AaABAg,-8lGCTFGEJs,yugu
531,Ugwg6PKec7hU1TgSIlV4AaABAg,-8lGCTFGEJs,como que martes era dios de la guerra  si lo es kratos chucetunare ctm hijo de la 3 pata
532,Ugx5ZJEAZ1iKhbHdZ114AaABAg,-8lGCTFGEJs,"El dios de la guerra es Ares no marte,  minuto:  2:00,  2:01, 2:02"
533,Ugx5ZJEAZ1iKhbHdZ114AaABAg.8Wlz25cwO7N8WmgeRQeunZ,Ugx5ZJEAZ1iKhbHdZ114AaABAg,https://es.marenostrum.info/index.php?title=Principales_dioses_romanos  emoji_backhand_index_pointing_left  LINK
534,Ugx5ZJEAZ1iKhbHdZ114AaABAg.8Wlz25cwO7N8WmgLwDTXib,Ugx5ZJEAZ1iKhbHdZ114AaABAg,"Ayyy!!! Eso es en Grecia, Roma tiene los mismos dioses  pero con otros nombres,... Mercurio, Venus(Afrodita), Marte(Ares), Júpiter (zeus), Urano, Neptuno(Poseidón), etc ... etc >:v"
535,UgyEaTf4moSyGsUF2554AaABAg,-8lGCTFGEJs, emoji_face_with_steam_from_nose  emoji_face_with_steam_from_nose  emoji_face_with_steam_from_nose 
536,Ugx63BHb6jaM5k-pfUh4AaABAg,-8lGCTFGEJs,Le sirve a mi hija :D
537,Ugx63BHb6jaM5k-pfUh4AaABAg.8WL7hjqY6X28YJ3aE1QHf8,Ugx63BHb6jaM5k-pfUh4AaABAg,jdkz
538,UgxflvewJ8urwtxEGpl4AaABAg,-8lGCTFGEJs,los he visto como 10veces en el dia para mi prueba de mañana uf me sirven demasiado y son muy buenos  emoji_thumbs_up  emoji_thumbs_up 
539,Ugw26jnUcsgV8jl4Ph54AaABAg,-8lGCTFGEJs,Dale like si te dijeron que tenias que estudiar y por eso estas viendo estos videos(No los culpo por que yo tambien)
540,Ugw26jnUcsgV8jl4Ph54AaABAg.8WCuqgTyfGh92NOKqIETc4,Ugw26jnUcsgV8jl4Ph54AaABAg,"No, porque yo he estudiado y a parte estoy viendo esto pa que se me queden las cosas."
541,Ugw26jnUcsgV8jl4Ph54AaABAg.8WCuqgTyfGh8qm1VIPBQoN,Ugw26jnUcsgV8jl4Ph54AaABAg,pos si broooooooooo
542,Ugw26jnUcsgV8jl4Ph54AaABAg.8WCuqgTyfGh8oQ4fg7M_oY,Ugw26jnUcsgV8jl4Ph54AaABAg,Sii
543,Ugw26jnUcsgV8jl4Ph54AaABAg.8WCuqgTyfGh8nyq3RPeRQm,Ugw26jnUcsgV8jl4Ph54AaABAg,Pamela Berroeta  y gual yo
544,Ugw26jnUcsgV8jl4Ph54AaABAg.8WCuqgTyfGh8nPIrUx4Lea,Ugw26jnUcsgV8jl4Ph54AaABAg,Obio
545,Ugw26jnUcsgV8jl4Ph54AaABAg.8WCuqgTyfGh8mERoATOUe8,Ugw26jnUcsgV8jl4Ph54AaABAg,Wueon
546,UgxS6-8MiN2tmiq6opl4AaABAg,-8lGCTFGEJs,me gusta el ico
547,Ugypf1kjesF_iC9r1KJ4AaABAg,-8lGCTFGEJs,Estoy aqui por Tarea de Etimologias :'u
548,Ugypf1kjesF_iC9r1KJ4AaABAg.8W3ip8176vd8WDCyZRdmeQ,Ugypf1kjesF_iC9r1KJ4AaABAg,pinche toni k pez :v
549,UgyRhm8p1EDsRb4YlzZ4AaABAg,-8lGCTFGEJs,mi profesor muestra tus vídeos y yo tambien los veo =)
550,UgxS_81m4rMfmLVx4HR4AaABAg,-8lGCTFGEJs,Jajaja 01 :35
551,UgwVuHueVAYoG4ZWcKx4AaABAg,-8lGCTFGEJs,justo estoy estudiando para un examen de mañana siempre a ultima hora
552,UggR5lAcSr5DzngCoAEC,-8lGCTFGEJs,A mi hija igual
553,UghWxR6OhdJ1KngCoAEC,-8lGCTFGEJs,"Demasiado simple, faltó Neoptólemo, Creúsa, Lavinia, Amulio (antes), Marte, Rea Silvia, Ascanio, Príamo, Numitor, Alba Longa, Latino, latinos, itálicos, indoeuropeos, etruscos y más."
554,UghWxR6OhdJ1KngCoAEC.8VNaTU5e8BC9ifhYiCJ4xs,UghWxR6OhdJ1KngCoAEC,de hecho está es la versión más completa que existe.. digno de History Channel.
555,UghWxR6OhdJ1KngCoAEC.8VNaTU5e8BC8qm1aM9aK8u,UghWxR6OhdJ1KngCoAEC,men pos si@H 97
556,UghWxR6OhdJ1KngCoAEC.8VNaTU5e8BC8l7_pYs6T3-,UghWxR6OhdJ1KngCoAEC,"Men es una síntesis de la historia de Roma para niños, no tema de informe final de geografía para la universidad"
557,Ugij22mEwxfjkXgCoAEC,-8lGCTFGEJs,quienes fundaron roma
558,Ugij22mEwxfjkXgCoAEC.8TYMReOMMXe8ZMLOWyq_Yl,Ugij22mEwxfjkXgCoAEC,romulo y remo
559,UghcJcjs5h7RjXgCoAEC,-8lGCTFGEJs,genial me sirvio mucho
560,Ugh8CIXaYNbSkHgCoAEC,-8lGCTFGEJs,"MUY INTERESANTES VÍDEOS, GRACIAS POR SU VALIOSO APORTE"
561,UggiO9gkkTkLBHgCoAEC,-8lGCTFGEJs,"Me sirvió mucho!! aunque estaría bueno que junten toda esa historia con la parte de Roma, y su república, imperio, etc. Asi se ve todo de una n.n/"
562,UggiO9gkkTkLBHgCoAEC.8T6XAMveneC9iffkBZiKzG,UggiO9gkkTkLBHgCoAEC,no mienta señora..
563,UggiO9gkkTkLBHgCoAEC.8T6XAMveneC94f8WmOv413,UggiO9gkkTkLBHgCoAEC,si
564,UggiO9gkkTkLBHgCoAEC.8T6XAMveneC9-Z21c-bWTm,UggiO9gkkTkLBHgCoAEC,SI WEY ES LA NETA POR QUE A MI ME SIRVIO EN EL EXAMEN O PRUEBA ENCERIO LOAMO
565,UgiiFNs8h41rSHgCoAEC,-8lGCTFGEJs,Excelente
566,UghQubLG0_kDTHgCoAEC,-8lGCTFGEJs,Este video explica muy bien el imperio de roma
567,UghtspaPuYHgfngCoAEC,-8lGCTFGEJs,"Hola Gracias me sirvio para mi Tarea solamente te falto mensionar que Romulo nombro a Roma en Honor a su hermano Remo, Roma."
568,UghJI6vF8-qyd3gCoAEC,-8lGCTFGEJs,os ha gustado no a mi tanbien me agutado
569,UggvCxj_CTPD53gCoAEC,-8lGCTFGEJs,chulo chulo chulo chul chulo chulo chulo chulo chulo chulo chulo chulo chulo
570,Ugg7jZ8Mir3JMngCoAEC,-8lGCTFGEJs,Amo sus videos!!! Muchas gracias <3
571,UgjI2NVgBrnkYngCoAEC,-8lGCTFGEJs,marte : DIOS de la guerra/ entonces si exisian esos dioses?
572,Ugj0RGp-6bIXO3gCoAEC,-8lGCTFGEJs,"venus era dios/a cierto?? y si tenia un hijo, entonces venus si existió?"
573,Ugg4OcgQFwHSXHgCoAEC,-8lGCTFGEJs,Me has salvado de un examen sobre Roma!!!!Muchas gracias!
574,Ugg4OcgQFwHSXHgCoAEC.8QoIYN1X6d49SFl4x--Cbp,Ugg4OcgQFwHSXHgCoAEC,A mí también jajja
575,Ugg4OcgQFwHSXHgCoAEC.8QoIYN1X6d48ykjm0FGUMs,Ugg4OcgQFwHSXHgCoAEC,A mi igual XD
576,UgwGZvcw8HVT-UaQHeB4AaABAg,-8lGCTFGEJs,esta muy pero que muy bien  emoji_thumbs_up  emoji_thumbs_up  emoji_thumbs_up  emoji_thumbs_up  emoji_thumbs_up  emoji_thumbs_up  emoji_thumbs_up  emoji_beaming_face_with_smiling_eyes  emoji_beaming_face_with_smiling_eyes  emoji_beaming_face_with_smiling_eyes  emoji_beaming_face_with_smiling_eyes  emoji_beaming_face_with_smiling_eyes  emoji_beaming_face_with_smiling_eyes  emoji_beaming_face_with_smiling_eyes  emoji_beaming_face_with_smiling_eyes  emoji_beaming_face_with_smiling_eyes 
577,UghmUak5xZAFNngCoAEC,-8lGCTFGEJs,a mi tamvien me encantan tus videos
578,UghmUak5xZAFNngCoAEC.8Pd17cKmC6g8ZIgkL3fS1M,UghmUak5xZAFNngCoAEC,Maria Villalovos También* :'v
579,UggBLiYd6r3RDXgCoAEC,-8lGCTFGEJs,Muy buen video! muy didáctico y bien explicado!
580,UghVv39XL6j-o3gCoAEC,-8lGCTFGEJs,Pero madre mia willy
581,UgjnvVjC2nBb3ngCoAEC,-8lGCTFGEJs,bueno
582,Ugi8s7VbybhCbHgCoAEC,-8lGCTFGEJs,antes este vídeo era uno dde 30 minutos?? o es mi idea :(
583,Ugi8s7VbybhCbHgCoAEC.8Lt6HzUxES99ifhxjJKhy4,Ugi8s7VbybhCbHgCoAEC,es la versión reducida del resumen del resumen del resumen del resumen del resumen
584,UggGqX5dJm7TD3gCoAEC,-8lGCTFGEJs,Video 100% Bueno y CRACK
585,UgjWI_m4IcYhkXgCoAEC,-8lGCTFGEJs,esto lo vi en mi escuela y me gusta
586,Ughn9ohdeiP9C3gCoAEC,-8lGCTFGEJs,esta muy bueno el video
587,Ughn9ohdeiP9C3gCoAEC.8LOWqX8qeXO8P0XDVpeI4a,Ughn9ohdeiP9C3gCoAEC,"Gracias! Nos encanta que te encanten los videos!! Ahora necesitamos que nos ayudes para poder hacer más videos como estos!! Si quieres, puedes ingresar en el link a continuación y descargar toda la serie de Ciencia e Historia: https://vimeo.com/ondemand/exploradoresdelahistoria
¡¡Cada 1000 descargas haremos nuevos videos!! Y tú podrás ver y compartir los videos con amigos y familia cuantas veces desees!!"
588,UgiaS2CBn4A-6XgCoAEC,-8lGCTFGEJs,me sirvio para la prueba de mañana
589,UgiaS2CBn4A-6XgCoAEC.8LJZl1t9pm58ku7T-jh3t3,UgiaS2CBn4A-6XgCoAEC,Alguien sabe donde ? Esta apuntando el dedo de la intro
590,UgiaS2CBn4A-6XgCoAEC.8LJZl1t9pm58_5Eqsuhtjz,UgiaS2CBn4A-6XgCoAEC,ati tambien te dejan pruaba
591,UgiaS2CBn4A-6XgCoAEC.8LJZl1t9pm58Y3_iZMlce8,UgiaS2CBn4A-6XgCoAEC,Richard Josue Duval Moreira igual  emoji_face_with_tears_of_joy 
592,UgiaS2CBn4A-6XgCoAEC.8LJZl1t9pm58P0XNP0XLX2,UgiaS2CBn4A-6XgCoAEC,"Gracias! Nos encanta que te encanten los videos!! Ahora necesitamos que nos ayudes para poder hacer más videos como estos!! Si quieres, puedes ingresar en el link a continuación y descargar toda la serie de Ciencia e Historia: https://vimeo.com/ondemand/exploradoresdelahistoria
¡¡Cada 1000 descargas haremos nuevos videos!! Y tú podrás ver y compartir los videos con amigos y familia cuantas veces desees!!"
593,Ugi7-giUYjCW6ngCoAEC,-8lGCTFGEJs,:v
594,Ugi7-giUYjCW6ngCoAEC.8Kz1s285nCi8iVGzD0F_vr,Ugi7-giUYjCW6ngCoAEC,ファストネム  ablas español o que :l
595,Ugi7-giUYjCW6ngCoAEC.8Kz1s285nCi8ZIgbkcM9g6,Ugi7-giUYjCW6ngCoAEC,ファストネム v:
596,UgjBl_EkDjAsYngCoAEC,-8lGCTFGEJs,Me sirve para estudiar
597,UgiNGIpCcGgMPXgCoAEC,-8lGCTFGEJs,Curiosamente
598,UgiNGIpCcGgMPXgCoAEC.8KfqFaKKmNL8LZLgHqPv61,UgiNGIpCcGgMPXgCoAEC,"Nos encanta que te encanten los videos!! Es bonito saber que te sirven y te ayudan tanto!!Ahora necesitamos que nos ayudes para poder hacer más videos como estos!! Si quieres, puedes ingresar en el link a continuación y descargar toda la serie de 16 capítulos completos por solo 7 dólares: https://vimeo.com/ondemand/exploradoresdelahistoria
¡¡Cada 1000 descargas haremos nuevos videos!! Y tú podrás ver y compartir los videos con amigos y familia cuantas veces desees!!"
599,UghXWz2kLCHW7XgCoAEC,-8lGCTFGEJs,Me ayudo mucho en mis tareas nwn
600,Ughhi2Ez1qd0EXgCoAEC,-8lGCTFGEJs,QUE DIBERTIDO SHAKIRA CANTA LINDO ME ENCANTA SUS DETALLES ESO SI ES INFANTIL SUS DETALLES LINDOS
601,UgjfcYAuCTtSQHgCoAEC,-8lGCTFGEJs,Por favor sube La llegada de los bárbaros a Roma
602,UgiGC0VtG7y9_ngCoAEC,-8lGCTFGEJs,muy bueno me sirvió muchisimo
603,UgiOTliwRrrCE3gCoAEC,-8lGCTFGEJs,Oye me sirve para mañana e
604,UggHGUpWas-k4XgCoAEC,-8lGCTFGEJs,me encanta tus videos amigo don muy interesante y explican muy bien todo felicidades
605,Uggb6S3l5O-bQngCoAEC,-8lGCTFGEJs,me ayudo en mi prueba
606,Uggb6S3l5O-bQngCoAEC.8HzGJ3c4Ik58L_hQh2J-_o,Uggb6S3l5O-bQngCoAEC,"Nos encanta que te encanten los videos!! Es bonito saber que te sirven y te ayudan tanto!!Ahora necesitamos que nos ayudes para poder hacer más videos como estos!! Si quieres, puedes ingresar en el link a continuación y descargar toda la serie de 16 capítulos completos por solo 7 dólares: https://vimeo.com/ondemand/exploradoresdelahistoria
¡¡Cada 1000 descargas haremos nuevos videos!! Y tú podrás ver y compartir los videos con amigos y familia cuantas veces desees!! Cada 1000 descargas haremos por lo menos 2 videos nuevos!!"
607,Ugi-gd41_-6ScXgCoAEC,-8lGCTFGEJs,a mi tambien emoji_heart_suit  emoji_heart_suit  emoji_heart_suit 
608,Ugi-gd41_-6ScXgCoAEC.8HrQo73nPWA8W15Sgu6QLO,Ugi-gd41_-6ScXgCoAEC,Astrolab Motion  le interesa mas la plata de que nosotros aprendamos
609,Ugi-gd41_-6ScXgCoAEC.8HrQo73nPWA8VuBKef2zc1,Ugi-gd41_-6ScXgCoAEC,estos videos en mi clase de historia la maestra no muestra
610,Ugi-gd41_-6ScXgCoAEC.8HrQo73nPWA8L_hXMwa2mT,Ugi-gd41_-6ScXgCoAEC,"Nos encanta que te encanten los videos!! Es bonito saber que te sirven y te ayudan tanto!!Ahora necesitamos que nos ayudes para poder hacer más videos como estos!! Si quieres, puedes ingresar en el link a continuación y descargar toda la serie de 16 capítulos completos por solo 7 dólares: https://vimeo.com/ondemand/exploradoresdelahistoria
¡¡Cada 1000 descargas haremos nuevos videos!! Y tú podrás ver y compartir los videos con amigos y familia cuantas veces desees!! Cada 1000 descargas haremos por lo menos 2 videos nuevos!!"
611,Ughy7E6FqpM5uHgCoAEC,-8lGCTFGEJs,"muy bueno me sirvio , gracias :D"
612,UgwvmOaQi30D9bdKjGh4AaABAg,mbkO20iws80,Nice  emoji_thumbs_up 
613,UgxO4njl8AGAVCM6QMd4AaABAg,mbkO20iws80,Very nice Video sharing fren
614,UgxbKURuqPaxr5kWEJR4AaABAg,mbkO20iws80,O sadharon.
615,UgwmmM5nC_t35Ny7Aul4AaABAg,mbkO20iws80,Darun vai..
616,UgwjNPmUlC6tb6t6JFN4AaABAg,mbkO20iws80,Very good
617,Ugy-kTHT1bn37C-SM1t4AaABAg,mbkO20iws80,Sir khub vlo laglo
618,Ugh2KexGr6bSfHgCoAEC,6N2WkkM4Lfs,gud voice m8
619,Ugx5LVRI7knj9sTh4gV4AaABAg,o9JAGsajwXw,Good vid  emoji_thumbs_up 
620,Ugx5LVRI7knj9sTh4gV4AaABAg.9cWrRguYe3t9cWtyoxoVQc,Ugx5LVRI7knj9sTh4gV4AaABAg,Thanks so much for your support!
621,UgzdjRo7pWlCLhtFA9h4AaABAg,7tR10I_6YNA,What fight
622,UgxpVdw_CaoayqDSXa14AaABAg,EJofIA4m708,coole jazz musik
623,UgyB628yNOE77VVCPQh4AaABAg,EJofIA4m708,Bin ich der einzige der sich denkt wenn Remus Romulus erschlagen hätte das Rom dann Rem heißt haha
624,UgyB628yNOE77VVCPQh4AaABAg.9MWBJ11TXHH9VpHXtmOmhy,UgyB628yNOE77VVCPQh4AaABAg,yaa!
625,UgyLFY-uG1Jr5Xx38rp4AaABAg,EJofIA4m708,1. Wer sind laut Sage die Eltern der Zwillinge Romulus und Remus? 2. Auf wessen Befehl wurden die Zwillinge ausgesetzt?  3. Wer rettet die Kinder?  4. Wer schenkt ihnen ein Stück Land und warum?  5. Warum tötet Romulus seinen Bruder?
626,UgyLFY-uG1Jr5Xx38rp4AaABAg.9MCAE-SJ8kI9ZWB4qDP89d,UgyLFY-uG1Jr5Xx38rp4AaABAg,1. Mars und rea2. Amulius 3. Die diener 4.  Wer ? Weiß ich nicht. Warum ? Weil sie amulius vertrieben haben und numitor wieder ein könig gemacht haben5. Um könig zu werden
627,Ugx89MxqyyxhA0EygNN4AaABAg,EJofIA4m708,Ist jemand auf  Hans Thoma Schule?
628,UgyTUFr4Ianl6JX4sjJ4AaABAg,EJofIA4m708,Ein wort : schule
629,UgxxtH2ZA8_4njXEox14AaABAg,EJofIA4m708,Wer guckt das auch wegen Schule
630,UgxxtH2ZA8_4njXEox14AaABAg.9KLGqQfCv3h9KkFoDsJV-a,UgxxtH2ZA8_4njXEox14AaABAg,Jep
631,UgxutcYWFy2cIgrL8gJ4AaABAg,EJofIA4m708,Was geht klasse 6/7
632,UgxutcYWFy2cIgrL8gJ4AaABAg.9JwID8Y5war9T2B-ks3pkB,UgxutcYWFy2cIgrL8gJ4AaABAg,MOIN
633,UgxutcYWFy2cIgrL8gJ4AaABAg.9JwID8Y5war9PAlUHuL3xc,UgxutcYWFy2cIgrL8gJ4AaABAg,hey
634,UgxutcYWFy2cIgrL8gJ4AaABAg.9JwID8Y5war9MiXNDNrOoY,UgxutcYWFy2cIgrL8gJ4AaABAg,Moin
635,UgzRH0x3Q96SGCVvm8R4AaABAg,EJofIA4m708,was geht klasse 7.1 hehe
636,Ugy-4fV_kDgXWoZPwA54AaABAg,EJofIA4m708,Moin
637,UgyhP31oUIePBIzodOt4AaABAg,EJofIA4m708,Danke für die erklärung.
638,UgyDzGtpLaIADgX5zMF4AaABAg,EJofIA4m708,Moin
639,Ugx_2dSb-FDmJLtjY7p4AaABAg,FeiSVnKzV1w,"i do believe a lot of the Romulus and Remus story. people have been actually raised by animals like the story of Dina Sanichar, the story of the roman god mars coming down from heaven is like in the bible verse (Genesis 11:5) except god does not rape but instead looks at the sinful city of Babylon , alba longa is actually a historical place, Romulus ascending to heaven is like the story of Enoch and Elijah, in 2020 archelogies found a tomb which could be the tomb of Romulus and in 2007 they also found postholes of a ancient dwelling and they were made in about 750 BC 3 years after Rome was founded"
640,Ugxq220g2Wf3w469i9d4AaABAg,FeiSVnKzV1w,Blue: Thus begins the most etymologically significant fratricide in history. As Romulus killed his brother Remus. That's why it's called ROME and not REME.
641,UgxreBkvw_bbjCi7wWp4AaABAg,FeiSVnKzV1w,i love these
642,UgzDbccgv5MkSxNV2Px4AaABAg,FeiSVnKzV1w,"Hey, can you make a video about Icarus?"
643,UgzbxLNFFXeZpXYt0IB4AaABAg,FeiSVnKzV1w,Romulus: I'm gonna build a wall
644,Ugy6YZxp_XCa9TenX2l4AaABAg,FeiSVnKzV1w,"Guys there are many similarities in the story of Romulus and Jesus. Romulus' birth by a virgin woman, going to heaven without dying and reappearing to a person to command him to spread Rome and conquer the world echoes Jesus' story. Maybe Jesus' story was based on Romulus' story. Maybe the Israelites under the Roman rule wanted to create a story similar to the Rome's origin story with little changes to mock them....like how the Kingdom of Rome began with their King Romulus, the Kingdom of God/Israelites would begin with their King of the Jews, the Messiah, Jesus Christ whose story is very similar to the Romulus' story"
645,UgwLKU1o2pjQ20kgJ4V4AaABAg,FeiSVnKzV1w,Why not just rule together?
646,UgxfoGceX7JTUyicTpx4AaABAg,FeiSVnKzV1w,Drop pitch of voice and make it clear
647,UgwKk7NvgWAo_cvFSkR4AaABAg,FeiSVnKzV1w,Bro i have advice
648,Ugx-yg7iGa1ywb2vl4l4AaABAg,FeiSVnKzV1w,Loved this one!!
649,UgxpUd7LsBFq9o66G414AaABAg,FeiSVnKzV1w,Family drama is always the most brutal drama. Great video!
