335,Ugj9U3Khb3GBQngCoAEC.8BZDfAWwWL_8BZc5aEaV4D,Ugj9U3Khb3GBQngCoAEC,"+statinskill The ""Romulans"" are a fictional species, and they're a kind of substrate of the old roman mythology (think of the names ""Romulus"" and ""Remus""!)Please have a look at: https://en.wikipedia.org/wiki/Romulus_and_Remusand you'll find out, why this song is made at a 50 % of a sort of latin!Many thanks for your comment!Best regards,Volker H. :)"
336,UgiHLRpqihT2T3gCoAEC,ooS0Hop_zhk,"How does one marches in space, though?"
337,UgiHLRpqihT2T3gCoAEC.896qCP20Q2b8C6EIdRJ41L,UgiHLRpqihT2T3gCoAEC,+Sir Krzysztof obviously marching in ships from quarters to battle stations
338,UgiHLRpqihT2T3gCoAEC.896qCP20Q2b896zVysnllp,UgiHLRpqihT2T3gCoAEC,+Sir Krzysztof  Marches take place almost always on planets - in this case on &quot;Romulus&quot; or &quot;Remus&quot; independent from being in space. There exist lots of marches for the Air Forces in different countries. Naturally they do not play marches in an aeroplane or jet - normally - but it's possible.
339,Ughzimd54ebfI3gCoAEC,ooS0Hop_zhk,"the warbird at 0:35 is upside down. It's a T'varo bird-of-prey, Reman designed."
340,Ughzimd54ebfI3gCoAEC.87mTXlbUKN79J0xgHRZuRw,Ughzimd54ebfI3gCoAEC,Tough lil ship!
341,Ughzimd54ebfI3gCoAEC.87mTXlbUKN78RoRDN3ZEEo,Ughzimd54ebfI3gCoAEC,Remans are a warp capable specie.
342,Ughzimd54ebfI3gCoAEC.87mTXlbUKN78NqiP98e8XG,Ughzimd54ebfI3gCoAEC,but remans were the slaves of the strong immortal Romulan Star Empire!
343,Ugi-6kLAUwLQqHgCoAEC,ooS0Hop_zhk,Makes me want to go out and launch a few photon torpedoes!!
344,Ugi-6kLAUwLQqHgCoAEC.85JMUNM8WsM8zzCBphzXfX,Ugi-6kLAUwLQqHgCoAEC,"@Flathead Gg244 Heavy Plasma Torpedoes even better,look like V'Ger weapon shots"
345,Ugi-6kLAUwLQqHgCoAEC.85JMUNM8WsM8yk1rAA0tTS,Ugi-6kLAUwLQqHgCoAEC,@Flathead Gg244 even better Quantum torpedoes
346,Ugi-6kLAUwLQqHgCoAEC.85JMUNM8WsM8KYCZXW-xkr,Ugi-6kLAUwLQqHgCoAEC,Better plasma torpedoes
347,Ugjvy0gj-iCuNHgCoAEC,ooS0Hop_zhk,Your music is very professional i really like it listening it to it for hours you should be producing major motion soundtracks
348,Ugjvy0gj-iCuNHgCoAEC.84piM04c-4d7-KiFVaKm0r,Ugjvy0gj-iCuNHgCoAEC,"+Commander Katarn ThanX(XXL) so much, Commander Katarn! I really appreciate your comment! Shure I could do eventually some major soundtracks, but I think, there is no need for the film- industry. They have their own composers - since years.Many, many thanks again, dear C.K. and the very best regards to you,Volker H. :)"
349,UgiOqCKjW-VndXgCoAEC,ooS0Hop_zhk,"This is how the Romulans in STO should have been! That's the way I envisioned them., anyways. People seem content with Republic/Rebel Alliance Fed 2.0."
350,UgiOqCKjW-VndXgCoAEC.84S0HlUicrt87dqgHSX6iq,UgiOqCKjW-VndXgCoAEC,"+MandaGirl  The Romulans should've been a third party that does its own thing and fights/teams up with either the Feds or the Klingons when their interests align. Instead, you've got the Romulan Republic which is allied to both of them and the neo-RSE which is a puppet of the Iconians and made out to suck as much as possible PLUS Romulus is destroyed. Not the ideal setting......."
351,UgiOqCKjW-VndXgCoAEC.84S0HlUicrt7-H2Ol0PKhU,UgiOqCKjW-VndXgCoAEC,"+MandaGirl Thanks again, dea MandaGirl!! I appreciate it very much!!"
352,Ugj6Eyattap9tHgCoAEC,ooS0Hop_zhk,Great job with the video volker. Do you think you might do a Klingon version? Thanks.
353,Ugj6Eyattap9tHgCoAEC.84QhkblsW7q7-QcQUiPcuN,Ugj6Eyattap9tHgCoAEC,+American2all I will do my very best. Thanks so much!!
354,Ugj6Eyattap9tHgCoAEC.84QhkblsW7q7-NevhE5lRR,Ugj6Eyattap9tHgCoAEC,"+Volker400 No problem. You keep making them, I'll keep watching them."
355,Ugj6Eyattap9tHgCoAEC.84QhkblsW7q7-KvhU_Y6RB,Ugj6Eyattap9tHgCoAEC,"+American2all Thanks so much, America2all! I'm honest to you:actually the ""Klingon-Space-Fleet March"" was planned (the melody is ready - completely) months before I do the ""Romulan March"". But there are no lyrics at the time. But it will be one of the next projects, I can do!Thanks again!Best regards,Volker H. :)"
356,UghhTL2FlOGtxHgCoAEC,ooS0Hop_zhk,Romulus et Remus aeterna!
357,UghhTL2FlOGtxHgCoAEC.83yPdKbDvNi7-NxdH0-ucG,UghhTL2FlOGtxHgCoAEC,+Volker400 You are welcome my friend. Keep up the good work!
358,UghhTL2FlOGtxHgCoAEC.83yPdKbDvNi7-MOX045uZG,UghhTL2FlOGtxHgCoAEC,"+HisHolyMajesty  Thanks so much, HHMajesty!! I'm very happy you enjoyed!!Best regards,Volker H. :)"
359,UgjyWdmbq2vuqHgCoAEC,ooS0Hop_zhk,Glad to see you're making Star Trek songs again! ;)
360,UgiEvy601cUneXgCoAEC,ooS0Hop_zhk,Cool!!!
361,Ugh_Q9iofD-j93gCoAEC,ooS0Hop_zhk,Awesome!!! I really like this expanded Romulan vocabulary ;).
362,UggO3UYHEWP8wXgCoAEC,ooS0Hop_zhk,Very exciting battle March. Hail the great Romulan Star Empire.
363,UggO3UYHEWP8wXgCoAEC.8311YvPyuGm9id_lVLkaef,UggO3UYHEWP8wXgCoAEC,AYE
364,UggO3UYHEWP8wXgCoAEC.8311YvPyuGm8qkGOb1CyJr,UggO3UYHEWP8wXgCoAEC,@The Admiral You have to admit the empire did have some kick-ass music though
365,UggO3UYHEWP8wXgCoAEC.8311YvPyuGm8Eut2vH7s_U,UggO3UYHEWP8wXgCoAEC,Pfft! <SPOILER ALERT>You get rekt by the Romulan Republic.
366,UggO3UYHEWP8wXgCoAEC.8311YvPyuGm7-QGUGhJ9wq,UggO3UYHEWP8wXgCoAEC,@Daniel Darcey Amen!!!
367,UghYVD13QXBeQngCoAEC,ooS0Hop_zhk,Fake Latin FTW?
368,UghYVD13QXBeQngCoAEC.82JeyWrmiBI8_yASyVe37u,UghYVD13QXBeQngCoAEC,"It sounds very close to Latin or a dialect thereof, so it has to be intentional."
369,UghYVD13QXBeQngCoAEC.82JeyWrmiBI7-H4E4ZKTrI,UghYVD13QXBeQngCoAEC,"@Badjoke Maker Yes, mostly, but not completely. ;)"
370,UghLtfCKlcIuH3gCoAEC,ooS0Hop_zhk,This sounds like it would be more at home on Cardassia
371,UghLtfCKlcIuH3gCoAEC.81GfzALUujV8Cac0Mv1QBj,UghLtfCKlcIuH3gCoAEC,"+supajasiu  Well, the Romulans are a lot like the Cardassians in mindset so it shouldn't be surprising that this sounds like a Cardassian theme."
372,Ugjrt4NUief8rHgCoAEC,ooS0Hop_zhk,Instrumental version plz?
373,UghH5Q6OSb44YHgCoAEC,ooS0Hop_zhk,"thank you for your great work, new content related to the Romulans makes mealways happy"
374,UghH5Q6OSb44YHgCoAEC.80BJO3IbpQQ9iQax9YFmKM,UghH5Q6OSb44YHgCoAEC,I think he should do an anti-Starfleet march next.
375,UghH5Q6OSb44YHgCoAEC.80BJO3IbpQQ7-L7Wt6SAIL,UghH5Q6OSb44YHgCoAEC,"@Benjamin Jeckel Ganz vielen Dank, Ben!! Die Romulaner sind auch meine Favoriten!!LG aus NRW/OWLVolker H. :)"
376,UgjJgF-rychQ9ngCoAEC,ooS0Hop_zhk,These songs make me frenzy haha. I'm ready to battle against the enemies of Romulus!
377,UgjJgF-rychQ9ngCoAEC.8041G_-Ylcs86RSVmPzgSj,UgjJgF-rychQ9ngCoAEC,+Volker400 This song gets me into a frenzy too and makes me want to go out and fight against the enemies of Romulus /especially the Klingons/!
378,UgjJgF-rychQ9ngCoAEC.8041G_-Ylcs7-KtlOefyMn,UgjJgF-rychQ9ngCoAEC,"@Legit Gamers Ha ha, I'm so happy, you appreciate it!! ;)))"
379,UggvasTCpfnpTHgCoAEC,ooS0Hop_zhk,"I love your hand made language for the romulans and all, but hear me out...It would be more than epic if you could you create anthem using the Rihannsu Language from Diane Duane books "" Rihannsu: The Bloodwing Voyages "". These guys have done most of the leg work: http://www.rihan.org/drupal/"
380,UggvasTCpfnpTHgCoAEC.80-yyD49JJT7-KinFfawQ0,UggvasTCpfnpTHgCoAEC,"@Teacon Delongus Many, many thanks, dear Teacon!! I appreciate it! But the music ""was"" and ""is"" for me the most important factor, never a fictional(!!) language!!Also, we should not forget, that ""STAR TREK"" is nothing more than entertainment and fantasy!!PARAMOUNT PICTURES is an immense large entertainment industry, which gets a lot of money for it!!For example: How would we, btw, pronounce (for example) the Romulan language? In an English-, German-, Indonesian-, Italian-, Russian-, Latin-, Dutch-accent? There will be no answer...I've ""closed"" the ""chapter""of ""STAR TREK-languages"" since years (btw, I know STAR TREK since 1972!!)So, we have Klingonese, Romulan, Vulcan...and where are the other languages? Tholian, Fabrini, Melcotes, Gorn, Bajoran, Edosian, Kazon, Organian, Reman(!), Tellarite, Cardassian and so on...If we were really consistent, we would take into account ALL languages of the STAR TREK universe!We shouldn't take it too seriously, I think!! ;)Nethertheless, many thanks for your fine comment, ...Best regards,Volker H. :)"
381,Ugg1BTewtT_7H3gCoAEC,ooS0Hop_zhk,"Fun video, sounds a little like Latin to me- especially in the spelling of the words in it,,, presumably that is intentional."
382,Ugg1BTewtT_7H3gCoAEC.8-GF3RQxVF77-yZLH_d16p,Ugg1BTewtT_7H3gCoAEC,"Looking forward to what you do next, Sir!"
383,Ugg1BTewtT_7H3gCoAEC.8-GF3RQxVF77-fMV5fCgjW,Ugg1BTewtT_7H3gCoAEC,"@chissstardestroyer Many many thanks, Chiss! I'll see forward. :)"
384,Ugg1BTewtT_7H3gCoAEC.8-GF3RQxVF77-df8ZnGKAq,Ugg1BTewtT_7H3gCoAEC,"I'd like to see those, as well as the Borg, the Terran Empire, and lesser known races like the Lyrans, Hydrans, Gorn, Tholians, and other Star Trek nationstates (such as the Lyran Democratic Republic- a break-away state from the Lyran Star Empire), the Mirak Star League, the Interstellar Consortium, and others as well.You, Sir, are brilliant for Star Trek Nationstate videos- keep it up!Signed:Chiss Stardestroyer."
385,Ugg1BTewtT_7H3gCoAEC.8-GF3RQxVF77-cgwUgMaxU,Ugg1BTewtT_7H3gCoAEC,"@chissstardestroyer Thanks soooooo much, chissstardestroyer!  Very good idea to do a Cardassian march, evt. also to the Ferengi (a very funny march, I think) or Bajorans? I'll think about it...Many thanks again, chis.!!Best regards,Volker (spoken ""Follka"" in English, btw...hehe...;)))))"
386,Ugg1BTewtT_7H3gCoAEC.8-GF3RQxVF77-Zu_PLFL6A,Ugg1BTewtT_7H3gCoAEC,"I look forward to listening to the next ""Star Trek Fleet March"" of yours, and you might also try on for the Cardassian Union too.Why not do one per Star Trek nation as well?I frankly love the idea of this video, and the other videos.Sincerely;Chissstardestroyer."
387,Ugg1BTewtT_7H3gCoAEC.8-GF3RQxVF77-YzKgZnR8E,Ugg1BTewtT_7H3gCoAEC,"@chissstardestroyer Many thanks again, dear C.! The most important factor especially to this music was to compose a ""catchy"" melody! A melody that everybody can sing. Btw, hope I can ""publish"" (eventually) the ""Klingon Space Fleet March"" the next days (or weeks...I don't know), which has also an extremely catchy melody.Best regards and many thanks to you,Volker H. :)"
388,Ugg1BTewtT_7H3gCoAEC.8-GF3RQxVF77-X90-_IyoN,Ugg1BTewtT_7H3gCoAEC,"Excellent! I do enjoy National Anthems of sci-fi races, though. And this is masterful."
389,Ugg1BTewtT_7H3gCoAEC.8-GF3RQxVF77-NYQ6VGePk,Ugg1BTewtT_7H3gCoAEC,@chissstardestroyer More than welcome!! ;)
390,Ugg1BTewtT_7H3gCoAEC.8-GF3RQxVF77-Mi_55VZzq,Ugg1BTewtT_7H3gCoAEC,"Yes, the Romulan Empire WAS probably based on the Roman Empire, so it only makes sense that the language would resemble Latin.I am a long passionate student of history, and I do love sci-fi fanfic- especially involving history.A surprising number of ""Romulan National Anthems"" are based on Latin- so it only makes sense, well, that and the fact that the Rihannsu typically utilize Roman Archetexture in their buildings.It's a true delight to get things right- thanks. And thanks for telling me the truth about it too. (that's worth more than any amount of praise to me)."
391,Ugg1BTewtT_7H3gCoAEC.8-GF3RQxVF77-IUZdDWHi2,Ugg1BTewtT_7H3gCoAEC,"@chissstardestroyer You're absolutely right, chissstardestroyer!That was intention!!Many thanks for your fine comment!Best regards,Volker H. ;)"
392,UgikyaaILWeh-XgCoAEC,ooS0Hop_zhk,I absolutely love this!  And I'm very glad to see that you're uploading new stuff again.  ^_^
393,UgikyaaILWeh-XgCoAEC.8-AG6J-r9jn7-I2A4vmDaS,UgikyaaILWeh-XgCoAEC,I'm in the same boat.  I think we have similar taste.
394,UgikyaaILWeh-XgCoAEC.8-AG6J-r9jn7-HoDnDIwj5,UgikyaaILWeh-XgCoAEC,"@RebeccaETripp Many thanks again, dear Rebecca!! Although I don't like such ""march-music"", it makes so much fun to compose and play it then nethertheless. It's pure fun, nothing more. :)))))Yours,Volker ;)))))"
395,Ughf1JbKYHObD3gCoAEC,ooS0Hop_zhk,Ein fantastisch Video! Gut Arbeit!
396,Ughf1JbKYHObD3gCoAEC.8-17bLtvsQE7-I0X6OgiN8,Ughf1JbKYHObD3gCoAEC,"@Saiyan48 Vielen Dank, Saiyan!! Ich habe mich über Deinen Kommentar sehr gefreut!! I appreciate it very much!Best regards,Volker H. ;)"
397,Ugj6j2MkUnE8HXgCoAEC,ooS0Hop_zhk,"greatly perfect, i wish the idiots from star trek online's dev team could understand what means romulan passion and discipline to use such great soundtracks instead that crap ones they currently use"
398,Ugj6j2MkUnE8HXgCoAEC.7zXd-8G3brl7-OiQh_ZHTs,Ugj6j2MkUnE8HXgCoAEC,"@Correio do Rio Midia de verdade I'm deeply honoured, dear Roger!! Thanks so much again!!"
399,Ugj6j2MkUnE8HXgCoAEC.7zXd-8G3brl7-Oe_EOlBtr,Ugj6j2MkUnE8HXgCoAEC,"@Volker400 Yes, it is.   I'm a reporter on a digital news page on facebook, sorry for post withe the news login, LOLIn fact, if there is no romulans, there is nothing for me on star trek.This march is a master piece!!!Keep doing your great music work, its a treasure for us allRegards,Roger"
400,Ugj6j2MkUnE8HXgCoAEC.7zXd-8G3brl7-MNgbvoHHB,Ugj6j2MkUnE8HXgCoAEC,"@Correio do Rio Midia de verdade Many, many thanks to you, Correio, for your very fine comment!! I appreciate it so much! The main musical point especially to this piece of music was - as ever - to make it very catchy! My favorite fictional species of STAR TREK  are the Romulans (as you do - I think ;)))Many thanks again, dear Correio, again!!Best regards,Volker H. ;)"
401,UgghCadFP4g5LHgCoAEC,ooS0Hop_zhk,"Ich frage mich wie D´tan so viele Verräter zusammenkarren konnte... Wenn man beim täglichen Drill diese Musik vorspielen würde, würde ich sogar auf Sold verzichten um in diesem Militär dienen zu dürfen :) Klasse Arbeit!"
402,UgghCadFP4g5LHgCoAEC.7-H0Z7-RFN47-P_6aOW8GH,UgghCadFP4g5LHgCoAEC,"@Das Vadder Vielen Dank, Das Vadder! Jetzt kenne ich fast die ganze romulanische ""Historie"". ;)))LGVolker H. ;)"
403,UgghCadFP4g5LHgCoAEC.7-H0Z7-RFN47-MypykzDFW,UgghCadFP4g5LHgCoAEC,"@Volker400 Also ich bin froh, dass da ein romulanischer Marsch draus wurde. Ich weiß nicht ob zu dem Verständnis von Ehre, Krieg und Militär der Klingonen ein Marsch so richtig passen würde. (Mal abgesehen davon, dass alles, was mit ""romulanisch"" tituliert wird immer besser ist als die Produkte der ""Konkurrenzvölker xD)D´tan war der kleine Junge in Spocks Dissidentengruppe auf Romulus in Star Trek -TNG und in der erweiterten Storyline von Star Trek Online der Anführer der romulanischen Republik, die nach der Zerstörung Romulus` die Völker der Remaner und Romulaner vereint hat und sich permanent den Befehlen der nach wie vor existierenden imperialen Ordnung und damit dem Tal Shiar und der Kaiserin Sela (Tochter von Tasha Yar; ebenfalls TNG) widersetzt."
404,UgghCadFP4g5LHgCoAEC.7-H0Z7-RFN47-KVLPQEyxg,UgghCadFP4g5LHgCoAEC,"@Das Vadder Hi hi, ganz vielen Dank, Das Vadder!! Ja, ich nehme doch an, dass dieses hier noch zur Anti-Desertations-Musik der Romulaner wird.Ich habe natürlich wieder mal eine relativ eingängige Melodie versucht zu erzeugen.    Witzig ist, dass ich ursprünglich den ""Klingonen-Raumflottenmarsch"" vorhatte hochzuladen - der war nämlich in Noten schon geschrieben und auch recht eingängig. Aber dann schob sich in Blitzeseile der ""Raumflottenmarsch der Romulaner"" in den Vordergrund. Übrigens ist das ganze Stück eine IMPROVISATION - also gar nicht wirklich komponiert. Aber durch die heutige Technik ist's möglich, durch Aneinanderreihung von Audioschnitten der Motivik ein ganzes Stück in Windeseile zu ""produzieren"".  Ist auch bei der ""cadassianischen Hymne"" das erste Mal ""passiert"". Eigentlich hasse ich Märsche leidenschaftlich, aber sie zu komponieren macht irrsinnigen Spaß.  Nochmals, ganz herzlichen Dank, für Deinen - wie immer - herrlich innovativen Kommentar (sooo genau wie Du kenne ich die romulanische Geschichte nämlich gar nicht!),LG aus NRW/OWL,Follka H. ;))))))))))"
405,UghMJXifHRTBFngCoAEC,ooS0Hop_zhk,I like this song. It sounds like pride within the song   And their is no match nor hope to stop such a fleet. I guess that romulan pride at its best I take it.  
406,UghMJXifHRTBFngCoAEC.7-H0Z7-AsY28gqerDgDoao,UghMJXifHRTBFngCoAEC,FINNALLY star trek gets its imperial March.
407,UghMJXifHRTBFngCoAEC.7-H0Z7-AsY28gEomk2PSpM,UghMJXifHRTBFngCoAEC,"I agree the RSE lost all legitimacy as an institution the moment they sold their own people to the Elachi. Nevertheless, I bet the Republic will become more like a Roman Republic in nature than a Fed-like ""democracy"" as D'Tan hopes. D'Tan is a good leader and managed to rally the scattered Romulans under a reconstruction project, but his ideals are too ""westernized"". In the end, a romulan Triumvirate will reestablish imperial glory like Caesar did, a new empire that serves the interests of the Romulan race rather than betraying it for hopes of more power."
408,UghMJXifHRTBFngCoAEC.7-H0Z7-AsY288wX3D-7tMR,UghMJXifHRTBFngCoAEC,"+Fedorahatter  More like they want to make the entire Romulan race pay for Sela shooting at one of them 200,000 years ago when she and the player went back in time to the moment when the Iconians were being destroyed by those races who hated and feared them for being too advanced."
409,UghMJXifHRTBFngCoAEC.7-H0Z7-AsY288wWhGcwpAl,UghMJXifHRTBFngCoAEC,"+Fedorahatter  It already IS fading into nothingness and given that it either ignored the needs of its citizens and stole Fed aid meant for the Romulan people or handed over anyone who didn't serve the RSE without question to the Elachi to be turned into more Elachi, the RSE doesn't deserve to exist anymore! Long live the Republic!!"
410,UghMJXifHRTBFngCoAEC.7-H0Z7-AsY271y8wWltvdM,UghMJXifHRTBFngCoAEC,@Fedorahatter perhaps. however the romulan star empire is far more experienced than the romulan republic and the empire has more experience starship crews.       
411,UghMJXifHRTBFngCoAEC.7-H0Z7-AsY271xgiux5sC1,UghMJXifHRTBFngCoAEC,@Fedorahatter i doubt it. the romulan star empire will be reborn in war.
412,UghMJXifHRTBFngCoAEC.7-H0Z7-AsY271xaS5oMSM7,UghMJXifHRTBFngCoAEC,@Fedorahatter  in that case can u join the bad guys 
413,UghMJXifHRTBFngCoAEC.7-H0Z7-AsY270IkW4qD-8T,UghMJXifHRTBFngCoAEC,@Fedorahatter a race such as the romulus are awesome.  
414,UghMJXifHRTBFngCoAEC.7-H0Z7-AsY27-IawdpWTGE,UghMJXifHRTBFngCoAEC,"Many, many thanks to you, Lordzac!! I'm very happy you enjoyed!!!I appreciate it!Best regards,Volker H. :)"
415,Ugi22wTfpbQ7engCoAEC,ooS0Hop_zhk,Memoratum ! :D bellissima ^^
416,Ugi22wTfpbQ7engCoAEC.7-H0Z7-90i59AP95j8kTQe,Ugi22wTfpbQ7engCoAEC,Ovviamente Romolo fondò Roma e Remo era il suo fratello gemello. Nel mito furono gli dei a decidere chi tra i due avrebbe fondato la città.
417,Ugi22wTfpbQ7engCoAEC.7-H0Z7-90i59AP8OEl6MMK,Ugi22wTfpbQ7engCoAEC,La grande Roma si è spinta nelle stelle!
418,Ugi22wTfpbQ7engCoAEC.7-H0Z7-90i59ANr1oX1Scp,Ugi22wTfpbQ7engCoAEC,"È bellissima è proprio latino.  Eh si i romulani sono i romani del 24esimo secolo. Ma se ci fosse un collegamento tra le due civiltà?  Le cellule degli antichi romani saranno volate nello spazio arrivando su Vulcano dove si saranno fuse con le cellule originali vulcaniane. In seguito alla guerra civile vulcaniana vinta dalla ""Raptor  Faction "", i vulcaniani vinti (  quelli con le cellule romane ) lasciarono Vulcano e raggiunsero i pianeti Romolus e Remus (tradotti in italiano Romolo e Remo ) e si rinominarono in Remani e Romulani. Ecco perché c'é il latino."
419,Ugi22wTfpbQ7engCoAEC.7-H0Z7-90i57-JNC-XSs3U,Ugi22wTfpbQ7engCoAEC,"Grazie, grazie, caro amico, per il bel commento!!Migliori saluti,Volker H. :)"
420,Ughs0m2uYoMh-XgCoAEC,ooS0Hop_zhk,***:-D!
421,Ughs0m2uYoMh-XgCoAEC.7-H0Z7-An9T7-HDEh4GyGc,Ughs0m2uYoMh-XgCoAEC,@Volker400 Magnificatum;-)!
422,Ughs0m2uYoMh-XgCoAEC.7-H0Z7-An9T7-H3DsM0Rn1,Ughs0m2uYoMh-XgCoAEC,"Gratiam, Jmedium Unum!! XDDDDDDDDDDDDD"
423,Ugg8Y7HxQ_EDDXgCoAEC,ooS0Hop_zhk,"It really sounds like ""See those ships coming towards you? Yep! That's our fleet of 2859 ships. And yes, you're screwed..."""
424,Ugg8Y7HxQ_EDDXgCoAEC.7-H0Z7-ErLk9iWa5MFBgc1,Ugg8Y7HxQ_EDDXgCoAEC,Lol yea
425,Ugg8Y7HxQ_EDDXgCoAEC.7-H0Z7-ErLk9Jt9lfBaNjp,Ugg8Y7HxQ_EDDXgCoAEC,"Best part of all, you wouldn't see them coming, they'd be cloaked until they're right on top of you."
426,Ugg8Y7HxQ_EDDXgCoAEC.7-H0Z7-ErLk9FUJvfSm_nA,Ugg8Y7HxQ_EDDXgCoAEC,"@Adam Hauson unless I'M the one designing Federation warships...I'd make sure I had 2 fleets....the Starfleet exploratory fleet would be crewed by civilians and have superior sensors for analyzing the cosmos but not much tactical ability to fight except for maybe against the occasional pirate...but beware enemies of the Federation, lest you think we leave our explorers unguarded, for the Federation Starfleet's mighty Mjolnir-class warcruisers are always lurking nearby (think a ship at least as big as a super star destroyer, with both the latest shields and Voyager's ""Engame"" armor, transphasic torpedoes, anti-proton cannons...which while nothing like the kind that the Doomsday weapon could put out should still be far more powerful than standard phasers....and finally for point defense some pulse phasers firing off at least Galaxy-class intensity phaser bolts...and metaphasic shield generators too.....for hiding in suns and catching an enemy unawares ;) :P - ship like that should be more than a match for even a Scimitar-class :P - oh and let's not forget the ability to launch a bunch of those Maquis-style fighter ships"
427,Ugg8Y7HxQ_EDDXgCoAEC.7-H0Z7-ErLk94TYMtpI8LU,Ugg8Y7HxQ_EDDXgCoAEC,"@Timothy Mckee I tried that with 54 Valadore MK.II warships and won while only losing about 1/3rd of that fleet, don't step on the super heavy romulan warhawk command ship's from birth of the Federation is all I'm saying."
428,Ugg8Y7HxQ_EDDXgCoAEC.7-H0Z7-ErLk8WFafGlj9qe,Ugg8Y7HxQ_EDDXgCoAEC,Why2859 ships?
429,Ugg8Y7HxQ_EDDXgCoAEC.7-H0Z7-ErLk87dqDPG_kqD,Ugg8Y7HxQ_EDDXgCoAEC,+Dávid Abonyi  They should've sent the fleet of 2859 ships to blow the crap of the Founders' Homeworld in 2371 then. Let's see the 150 Jem'hadar fighter ships take THAT fleet on!
430,Ugg8Y7HxQ_EDDXgCoAEC.7-H0Z7-ErLk7-H3b18wxMX,Ugg8Y7HxQ_EDDXgCoAEC,"Ha ha, many, many thanks Dávid!!! I appreciate it so much! XDBest regards,Volker ;)))))"
431,Ugy2IB8hIpOCjulFoup4AaABAg,-8lGCTFGEJs,Igual se me hizo muy largo el video
432,Ugy2IB8hIpOCjulFoup4AaABAg.9iffpxOmnFY9jrnSbL49hl,Ugy2IB8hIpOCjulFoup4AaABAg,"Hola!Lamentamos que te haya parecido largo el video, te podemos ofrecer nuestro nuevo canal de YouTube donde los videos son de menor duración pero super entretenidos!Te invitamos a visitar nuestro nuevo canal de Science Songs https://www.youtube.com/channel/UC3lhbSrU3si4AMnIX8QSqGQTe esperamos!"
433,UgxHoElHhXBkH0_rXwl4AaABAg,-8lGCTFGEJs,HOLA! NO ESTA EL VIDEO COMPLETO?
434,UgxHoElHhXBkH0_rXwl4AaABAg.9hYMGHxAmlc9hZYsW_GV1J,UgxHoElHhXBkH0_rXwl4AaABAg,Hola! Puedes descargar toda la serie de 16 capítulos en el link a continuación: https://www.vimeo.com/ondemand/exploradoresdelahistoria
435,UgykSghzsUz94QM3qtt4AaABAg,-8lGCTFGEJs,que asco
436,UgwPVi_OmX01UuSZ-wt4AaABAg,-8lGCTFGEJs,:P
437,UgwKqzkGcTbsD9UhVZx4AaABAg,-8lGCTFGEJs,Saludos Cordiales  emoji_hourglass_not_done  Yahvismo???. Hechos 2:21. Salmo 27. 10 Mitzvot Mandamiento. Emeth. Si la base de tu fe es errado todo lo que edificaste sobre ella es errado. Salmo 51.
438,Ugxs-DrL0tnjPtfOLO14AaABAg,-8lGCTFGEJs,ayudaaa
439,UgxE-NnCCXbLIPo3ng94AaABAg,-8lGCTFGEJs,<3
440,Ugwwij6HdKLKq2fzI6Z4AaABAg,-8lGCTFGEJs,XD
441,UgzpYiAGgxJeNNfwJuB4AaABAg,-8lGCTFGEJs,Me salvo de un exsamen en historia !
442,UgzpYiAGgxJeNNfwJuB4AaABAg.9S46uVYIPJ29S4KFblqbpg,UgzpYiAGgxJeNNfwJuB4AaABAg,"¡Hola Gabriela! ¡Qué bueno! Si quieres ver el episodio entero o la serie completa puedes pedirle a tus padres que la adquieran a través de nuestro canal On Demand en Vimeo: www.vimeo.com/ondemand/exploradoresdelahistoria. Ahí también podrán ver otras series originales de Astrolab en español, inglés y portugués, con temas de Ciencia, Humanidades, Experimentos y mucho más! Compartimos el link: www.vimeo.com/astrolabmotion/vod_pages"
443,Ugysg3AFluySL1-MLYZ4AaABAg,-8lGCTFGEJs,Like si sos del 2019
444,Ugw9-CPnDC_a-x6n3iF4AaABAg,-8lGCTFGEJs,MI PROFE DE SOCIALES SUBE DE ESTOS VIDEOS THX TENIA PRUEBA FINAL Y SALGO DE VACACIONES
445,UgwAxXX6-NZzQ3WoyJV4AaABAg,-8lGCTFGEJs,like si tienes trabajo de esto
446,UgxbdR2hG4AeL3irjS54AaABAg,-8lGCTFGEJs,Esta un poco mal explicado la verdad. Se saltan muchas partes y a mucha gente del árbol genealógico... Esto no es el mito fundacional de Roma..
447,UgxbdR2hG4AeL3irjS54AaABAg.901nbgZ16O39ifh_s_DCHS,UgxbdR2hG4AeL3irjS54AaABAg,Información precisa para una tesis de Universidad.
448,Ugzrv30UmljHv2m2esZ4AaABAg,-8lGCTFGEJs,"KMJKFGNFJKMNGNJGKJSNJNGJRNGJKRRJKHNRJNGH157N402N765K4528569KOLFXC, NFLN,NBFHXFDJN"
449,Ugy61WcymgOdiaipTnZ4AaABAg,-8lGCTFGEJs,MOMO WEI
450,UgyybHalDrHD589nC3x4AaABAg,-8lGCTFGEJs,GATOS GATOS GATOS
451,UgwwFrIf3KBSOAg3Myx4AaABAg,-8lGCTFGEJs,Yo mañana tengo prueba sobre este texto que me baiga bien.
452,UgztCSL8TxI0dwmdahh4AaABAg,-8lGCTFGEJs,Me. Encanta. Y me sirve para estudiar
453,UgztCSL8TxI0dwmdahh4AaABAg.8zOquE2cW7K8zOtsYBLGMQ,UgztCSL8TxI0dwmdahh4AaABAg,Hola soy yo misma
454,UgwG7bOTqU-W-7YyY5l4AaABAg,-8lGCTFGEJs,Pero cuenten todo >:v
455,UgwG7bOTqU-W-7YyY5l4AaABAg.8ynXOMX1grs9ifhe1z6YL3,UgwG7bOTqU-W-7YyY5l4AaABAg,que mas necesitas saber?
456,UgyhnjNu9VjgU4T4gDh4AaABAg,-8lGCTFGEJs,Gracias profesores!!!!Mi profesor me enseña estos videos en la clase -w-''
457,UgycNt__tS-6HD5aM514AaABAg,-8lGCTFGEJs,like este creo que es el curso de ciencia sosiales
458,UgwXEC8pVn0MtRTiEEl4AaABAg,-8lGCTFGEJs,gracias sus videos son educativos y me fueron de  MUCHA ayuda :D
459,UgzFhVP-a7izbsPPb0R4AaABAg,-8lGCTFGEJs,"Esta buena la explicación del mito, falta el origen verdadero eso si, gracias"
460,UgyoKKQZUg5vcJVPDQB4AaABAg,-8lGCTFGEJs,falso te as copiado del vidio de otra persona por eso te e denunciado
