176,UgxwYY08XYNC9aKKWIl4AaABAg.94JVAcqiKPM9DiCicTFVHs,UgxwYY08XYNC9aKKWIl4AaABAg, emoji_rolling_on_the_floor_laughing  emoji_rolling_on_the_floor_laughing  emoji_rolling_on_the_floor_laughing  That was a good episode
177,UgxCW9JnLYD3KdJY2v14AaABAg,ooS0Hop_zhk,So  COOL and AWESOME !!
178,UgxCW9JnLYD3KdJY2v14AaABAg.92EpQ5wgXn992Ja_oLBRDe,UgxCW9JnLYD3KdJY2v14AaABAg,"ThaaaanX(XXL) so much, Burton!! I'm deeply honored!! I appreciate it!!Thanks again, and best regards to you,Volker L. H.:)"
179,Ugzot5rOsOY7-DFK1kp4AaABAg,ooS0Hop_zhk,28 Klingons Disliked.
180,UgxqOk1EAcm7QkmtXYZ4AaABAg,ooS0Hop_zhk,ch'Rihan u'ch'Havran gen u' fvaennh ssiun mollais ch'Rihan!
181,UgwKXFFKOugO_1sGEEt4AaABAg,ooS0Hop_zhk,"Romulus and Remus were the twins of Roman legend who founded Rome. This sounds like an ancient Latin-inspired language, too."
182,UgwKXFFKOugO_1sGEEt4AaABAg.90IqhtMU_SH9_xcrMVYjj1,UgwKXFFKOugO_1sGEEt4AaABAg,@Volker400 Well a couple of years later---you're most welcome and the best to you as well.
183,UgwKXFFKOugO_1sGEEt4AaABAg.90IqhtMU_SH9_wUODNDzdu,UgwKXFFKOugO_1sGEEt4AaABAg,"As a dog and wolf lover, I loved the story/fable regarding the statue. Don't remember the details, but it has to do with a mother wolf nursing Romulus and Remus."
184,UgwKXFFKOugO_1sGEEt4AaABAg.90IqhtMU_SH9YEwvSZs7_O,UgwKXFFKOugO_1sGEEt4AaABAg,"@Trevor Millar Actually, Rihannsu"" means ""The Declared""."
185,UgwKXFFKOugO_1sGEEt4AaABAg.90IqhtMU_SH9TNJ2pXvFfp,UgwKXFFKOugO_1sGEEt4AaABAg,"According to the novelties Romulan Way""  the Romulans' name for themselves is ""Rhihannsu"", which means ""WE, from here"". Humans are called ""Them, from there"", and Klingons are ""More of them from somewhere else""."
186,UgwKXFFKOugO_1sGEEt4AaABAg.90IqhtMU_SH99_I0IuLorE,UgwKXFFKOugO_1sGEEt4AaABAg,@Volker400 speaking off how you thought of doing the Imperium or Eldar from 40k?!
187,UgwKXFFKOugO_1sGEEt4AaABAg.90IqhtMU_SH90LgojA0ju7,UgwKXFFKOugO_1sGEEt4AaABAg,"Thanks so much, Meridien, for your very fine comment! You're right!Yes, this song is a symbiosis sung with a sort of pseudo-latin & Romulan (proto-romulan) with musical influences of the romans!   Thanks so much again, and thebest regards to you,Volke L. H. ;)))"
188,Ugzpw7pNTMT8KM85aLl4AaABAg,ooS0Hop_zhk,"I took Latin in School, why did they model the Romulan culture after the Romans? Yes I understood most of this supposed Romulan language, it's Latin LOL!  The very little bit of actual spoken Romulan dialogue on Star Trek sounds a bit like Gaelic mixed in with Latin and Farsi?"
189,Ugy5ppnpCXRgZ5BYbE94AaABAg,ooS0Hop_zhk,"if they created an entire language for Klingons, then why is the Romulan language just latin?-_-"
190,Ugy5ppnpCXRgZ5BYbE94AaABAg.8w0QyrDyhj08xVVfAYGdGa,Ugy5ppnpCXRgZ5BYbE94AaABAg,"Volker400 Vulcan is also a fully formed language, but not as advanced as Klingon has become. If you go to the town of Vulcan in Canada, you’ll be greeted by a statue of a suspiciously Enterprise looking ship, with a dedication in English, Klingon and Vulcan."
191,Ugy5ppnpCXRgZ5BYbE94AaABAg.8w0QyrDyhj08wNOcGlqFeJ,Ugy5ppnpCXRgZ5BYbE94AaABAg,"Amy, this language, I used here, is my very own invention for this piece of music. It's a sort of a symbiosis between latin and romulan.  But in one case, you are absolutely right (I'm with you here): Why do they invent an entire language for the Klingons and not for other spezies in STAR TREK? That would be also very logical!  Thanks so much for your question, dear Amy, and to youthe best regards,Volker L. H. :)"
192,UgyBqJ1azV1LDOBIUaR4AaABAg,ooS0Hop_zhk,"As much as I prefer the Republic to the Empire, I have to admit this kicks ass"
193,Ugyivr8Kk9dfXJ3mt3F4AaABAg,ooS0Hop_zhk,"Isn't it suppose to be Ch'rihan Shiar? Byzantine Empire, for exampre never was Byzantine in was ""Basileia ton Romaion"" (Roman Empire)... So maybe there is a way to create something more fitting ""Romulans""? I mean that one is good but latin, and another one is more accurate but still there are some latin words. Maybe it is a time to create new wersion? Would be glad to here, if u are still around."
194,Ugyivr8Kk9dfXJ3mt3F4AaABAg.8udRjC3Lp2x8uf7P-rY3nE,Ugyivr8Kk9dfXJ3mt3F4AaABAg,Volker400 ambitions will guide us all under the shadow of the predators wings)
195,Ugyivr8Kk9dfXJ3mt3F4AaABAg.8udRjC3Lp2x8uf63UxN1nH,Ugyivr8Kk9dfXJ3mt3F4AaABAg,"I'm very sorry, Ivan! But I have no ambitions to do a new one.Best regards to you,Volker L. H."
196,Ugz0oy7LlReR2Ip5Msp4AaABAg,ooS0Hop_zhk,Long live Saint Catholic Army!
197,Ugz0oy7LlReR2Ip5Msp4AaABAg.8tWPmXpCm549-U6g3LD2Ip,Ugz0oy7LlReR2Ip5Msp4AaABAg,All Hail Romulus and Remus!
198,UgzAgdFsDZkJe8LxZjN4AaABAg,ooS0Hop_zhk,We've all heard the klingon theme but I've never heard the romulan battle theme before. Very proletarian sound. emoji_thumbs_up 
199,UgwJErUbT9C9S-uhpoN4AaABAg,ooS0Hop_zhk,"Sub-Commander, ready my Warbird---those Klongon veruuls are going to regret the day they were born!!!!"
200,UgwPGdmXeQaJxfks5EJ4AaABAg,ooS0Hop_zhk,"Romulans=Romans, Italian, Latin, Byzantine!"
201,UgySQnHsZ_XbwHPy1E54AaABAg,ooS0Hop_zhk,Is a old latin langage  !!!
202,UgwxuBIH3euHw8YS4MV4AaABAg,ooS0Hop_zhk,Romans in space
203,UgwxuBIH3euHw8YS4MV4AaABAg.8mKILhcLikp8mNkqKykXhK,UgwxuBIH3euHw8YS4MV4AaABAg,"You're absolutely right!! The song text AND the music have some ""Roman""-styleelements! Thanks so much for your comment!Best regards,Volker L. H. :)"
204,Ugyyi6K9fS5qIHsLL4R4AaABAg,ooS0Hop_zhk,"Romulan Commander Keras: ""The enemy commander will follow us. He must! And when he attacks. We will destroy him!"""
205,Ugywnq1cNySC79fc_kx4AaABAg,ooS0Hop_zhk,"This is so sad, can we conquer the Alpha Quadrant?"
206,Ugz6fw-yIse1Dn7n3Kt4AaABAg,ooS0Hop_zhk,Break out the Romulan Ale!
207,Ugz6fw-yIse1Dn7n3Kt4AaABAg.8h2y-1GLTQy8sQH1cEtB0q,Ugz6fw-yIse1Dn7n3Kt4AaABAg,"And Khellid honey was in the Virinat ale. Damn the Tal Shiar for wrecking Virinat,their ale must have been like oak matured Mead, smooth as tholian silk."
208,Ugz6fw-yIse1Dn7n3Kt4AaABAg.8h2y-1GLTQy8hhGRNZNDcK,Ugz6fw-yIse1Dn7n3Kt4AaABAg,Kali-fal is good too!
209,Ugz6fw-yIse1Dn7n3Kt4AaABAg.8h2y-1GLTQy8h3PoEJ8Nl4,Ugz6fw-yIse1Dn7n3Kt4AaABAg,"Ha, ha, good idea, Mike!! Cheers!!! ;))))))))))))))))"
210,Ugxpg_Y7h_uGLgjG78p4AaABAg,ooS0Hop_zhk,THIS IS FUCKING SPARTA!!!
211,Ugxpg_Y7h_uGLgjG78p4AaABAg.8gqen0NE9nK8gsw6yQPrW2,Ugxpg_Y7h_uGLgjG78p4AaABAg,"I AM LOCUTUS OF YOUTUBE, YOUR CHANNEL AS YOU'VE KNOWN IT IS OVER FROM THIS MOMENT FORWARD YOU WILL LIKE MY COMMENTS."
212,Ugxpg_Y7h_uGLgjG78p4AaABAg.8gqen0NE9nK8gs3-PpX70N,Ugxpg_Y7h_uGLgjG78p4AaABAg,"...aaaand your comment is fucking fantastic!! ;))))) Thanks sooo much, Jean -Luc (Picard) Martel!!I appreciate it!!Best regards to you,Volker L. H. :)"
213,UgyKVKXkakZI6P8pE1l4AaABAg,ooS0Hop_zhk,Health to D'Tan
214,UgyKVKXkakZI6P8pE1l4AaABAg.8gciIh-WB6l9J0xvJiRBmn,UgyKVKXkakZI6P8pE1l4AaABAg,"@Kitonioko 1.0 And on Mol'Rihan, Romulans and Remans will be together in peace and friendship!  emoji_smiling_face_with_heart-eyes "
215,UgyKVKXkakZI6P8pE1l4AaABAg.8gciIh-WB6l8uXoi_hdPpX,UgyKVKXkakZI6P8pE1l4AaABAg,Cause remans are good guys too.
216,UgyKVKXkakZI6P8pE1l4AaABAg.8gciIh-WB6l8sQH_XuEjUK,UgyKVKXkakZI6P8pE1l4AaABAg,Health to Obisek too.
217,UgyKVKXkakZI6P8pE1l4AaABAg.8gciIh-WB6l8gciP0_Jq5z,UgyKVKXkakZI6P8pE1l4AaABAg,And health to the Romulan Repuplic
218,UgymwgzwvUFhyjXNEOh4AaABAg,ooS0Hop_zhk,https://youtu.be/U06jlgpMtQs
219,UgyP7hz3Bi1KGM2b2ix4AaABAg,ooS0Hop_zhk,Almost sounds Russian lol
220,UgxDFLu8f0LtzljNZR94AaABAg,ooS0Hop_zhk,RISE OF THE GERMAN EMPIRE
221,UgxDFLu8f0LtzljNZR94AaABAg.8fUHWg5047u8fknTKKUHM6,UgxDFLu8f0LtzljNZR94AaABAg,II--Crazy--II Roman empire plesso.  German no thanks
222,UgwSVA_4uLSGQa8NeB94AaABAg,ooS0Hop_zhk,Latin Rules.
223,UgwSVA_4uLSGQa8NeB94AaABAg.8eE04AU5tx78eFSOWYiZ4Q,UgwSVA_4uLSGQa8NeB94AaABAg,"Vivat Latin! You are right!Best regards to you,Volker L. H. :)"
224,UgxukfKJdWJzTGTYo8N4AaABAg,ooS0Hop_zhk, emoji_thumbs_up_light_skin_tone  emoji_thumbs_up_light_skin_tone  emoji_thumbs_up_light_skin_tone 
225,UgxukfKJdWJzTGTYo8N4AaABAg.8e3vqguUBPs8eFSCuNCLOG,UgxukfKJdWJzTGTYo8N4AaABAg,"Ja, ich auch! Nochmals danke!"
226,UgxukfKJdWJzTGTYo8N4AaABAg.8e3vqguUBPs8e8Te5o41et,UgxukfKJdWJzTGTYo8N4AaABAg,Sind sie Star Trek Fan ? emoji_OK_hand_light_skin_tone  ich natürlich auch
227,UgxukfKJdWJzTGTYo8N4AaABAg.8e3vqguUBPs8e7pM8WIBci,UgxukfKJdWJzTGTYo8N4AaABAg,"Vielen Dank, Jakob!! :)"
228,UgyGW7IpWgJm0FgG2yl4AaABAg,ooS0Hop_zhk,"Cool, also here is my Klingon tribute song....enjoy.https://www.youtube.com/watch?v=sHAxKoTuJKE"
229,UgxH8JuwxF810A3Zgfx4AaABAg,ooS0Hop_zhk,"Romulus et Remus!   Romulus et Remus! Emire degidus, Emire legibus.Romulus et Remus!  Deri-Deri-Derium! Deri husarium.Deri husarium.Deridexium.  Romulus et Remus!Deridex coronarium.Romulus et Remus!Deri husarium.Deri husarium.Deridexium.Romulus et Remus!Romulus et Remus!Remus et Romulus!Remus! Romulus!Remus et Romulus!Deridex coniunctibus. Romulus et Remus!Erissa dominaribus! Romulus et Remus (est)! Deri husarium.Deridexium. Mna mne Deridexium.Romulus et Remus est! Romulus et Remus! Deridex con Imperium!Romulus et Remus!Remus con Romulus!==============English Translation:==============Romulus and Remus!Romulus and Remus!Command our welfare, Command our rights.Romulus and Remus!Imperial - imperial - Empire!Imperial Cavalry. (""cavalry"" = little Romulan space raiders)Imperial Cavalry.Our Imperium!Romulus and Remus!Romulus and Remus!Remus and Romulus!Remus! Romulus!Remus et Romulus!To one imperium connected.Romulus and Remus!Avoid any dominating!Romulus is Remus, Remus is Romulus!Imperial Cavalry.Our Imperium!Our great Imperium.Romulus is Remus, Remus is Romulus!Romulus and Remus!Connected to one Imperium!Romulus and Remus!Remus with Romulus! (in the sense of ""We make it!"")"
230,UgxH8JuwxF810A3Zgfx4AaABAg.8cx4AHHKS0q9AKzeTSSaaT,UgxH8JuwxF810A3Zgfx4AaABAg,@Antonio Carlo Spagnuolo Yep.
231,UgxH8JuwxF810A3Zgfx4AaABAg.8cx4AHHKS0q9AK5HN9u5cn,UgxH8JuwxF810A3Zgfx4AaABAg,And. Spanish. too.
232,UgxH8JuwxF810A3Zgfx4AaABAg.8cx4AHHKS0q9AK5AJL9CFg,UgxH8JuwxF810A3Zgfx4AaABAg,"@Jamie Olberding  there are italian  ,  french   romanian.   and.  portughese."
233,UgxH8JuwxF810A3Zgfx4AaABAg.8cx4AHHKS0q9AIiILJfmnJ,UgxH8JuwxF810A3Zgfx4AaABAg,@Antonio Carlo Spagnuolo Cool.
234,UgxH8JuwxF810A3Zgfx4AaABAg.8cx4AHHKS0q9AIaz8ZSwv8,UgxH8JuwxF810A3Zgfx4AaABAg,@Jamie Olberding  its not spoken  today.  But there are  many.   neo latin languages
235,UgxH8JuwxF810A3Zgfx4AaABAg.8cx4AHHKS0q9AILOYLvMyC,UgxH8JuwxF810A3Zgfx4AaABAg,@Antonio Carlo Spagnuolo I thought Latin was a forever lost dead language that is rarely spoken nowadays?
236,UgxH8JuwxF810A3Zgfx4AaABAg.8cx4AHHKS0q9AIKwTLt6M3,UgxH8JuwxF810A3Zgfx4AaABAg,É latino!!!!! It's latin !!!!! I have writed a comment for the federation anthemn.  Go see it !!!!!!!!!
237,UgxH8JuwxF810A3Zgfx4AaABAg.8cx4AHHKS0q8xVV9HH8K0l,UgxH8JuwxF810A3Zgfx4AaABAg,You copied the translation from the description lol
238,UgxH8JuwxF810A3Zgfx4AaABAg.8cx4AHHKS0q8pQoW8ab05G,UgxH8JuwxF810A3Zgfx4AaABAg,Thank you for the in translation  emoji_eagle 
239,UgxH8JuwxF810A3Zgfx4AaABAg.8cx4AHHKS0q8oD8TFjYcCW,UgxH8JuwxF810A3Zgfx4AaABAg,Thank you for the translation and it is long but it's still very it is very beautiful as a poetry
240,UgzcuB1rKbbViKEaqkh4AaABAg,ooS0Hop_zhk,"Eres un genio, me encantan tus composiciones."
241,UgzcuB1rKbbViKEaqkh4AaABAg.8bxon_wMNhE8c4pBcCjI3j,UgzcuB1rKbbViKEaqkh4AaABAg,"Gracias, querido amigo, por su agradable comentario. ¡ me siento profundamente honrado!Gracias de nuevo y muchos saludos,Volker L. H. :)"
242,UgyJqg4O1eLe4eUsFr54AaABAg,ooS0Hop_zhk,This background was actually meant to be mirror Romulan xD
243,Ugwzzi8h0uNa-Vgtmp14AaABAg,ooS0Hop_zhk,"Do you mind if I use this melody (instrumental of this march) as part of some media I'm creating? I made some lyrics, lore, etc. based on the melody of this march."
244,Ugwzzi8h0uNa-Vgtmp14AaABAg.8bLbkl62KoH8bMnf4kxoAb,Ugwzzi8h0uNa-Vgtmp14AaABAg,"No problem! You can use it!Best regards,Volker L. H."
245,Ugxnb6rUTrWO2WxEMtx4AaABAg,ooS0Hop_zhk,"Daleks :""DALEKS REIGN SUPREME! ALL HAIL THE DALEKS! DALEKS REIGN SUPREME! ALL HAIL THE DALEKS! DALEKS REIGN SUPREME! ALL HAIL THE DALEKS! DALEKS REIGN SUPREME! ALL HAIL THE DALEKS! DALEKS REIGN SUPREME! ALL HAIL THE DALEKS!""Dalek Supreme: ""BEHOLD DOCTOR! BEHOLD THE MIGHT OF THE TRUE DALEK RACE!"""
246,Ugxnb6rUTrWO2WxEMtx4AaABAg.8aRz9nuW2DZ8abEi8smTT-,Ugxnb6rUTrWO2WxEMtx4AaABAg,"Nam'ut ralash-fam!!!(Translated: ""SHUT UP!"" in Vulcan)"
247,UgyyGUww-yEeXS2AOAt4AaABAg,ooS0Hop_zhk,Hitler's favourite Song in 42/43
248,UgzdMc9oF2EhLel1K-p4AaABAg,ooS0Hop_zhk,Hitler's favourite Song in 42/43
249,Ugwi5F4-qF45_Vv36GJ4AaABAg,ooS0Hop_zhk,Awesome song.
250,Ugwi5F4-qF45_Vv36GJ4AaABAg.8Zuh_D8K51Z8Zzc87e-f0S,Ugwi5F4-qF45_Vv36GJ4AaABAg,"Thanks so much, Quentin, for your kind comment! I'm happy you enjoyed!!Best regards to you,Volker L. H. :)"
251,UgyIXP4ct5J3_6fm1MN4AaABAg,ooS0Hop_zhk,ROMULUS ET REMUS! ROMULUS ET REMUS!
252,UgzIkuz4F9c9DbmR3DJ4AaABAg,ooS0Hop_zhk,Awesome Romulan theme!
253,UgzIkuz4F9c9DbmR3DJ4AaABAg.8YuzFaIdPW38cx4Dp-IDxo,UgzIkuz4F9c9DbmR3DJ4AaABAg,You're welcome!
254,UgzIkuz4F9c9DbmR3DJ4AaABAg.8YuzFaIdPW38YwhUXYh3Wb,UgzIkuz4F9c9DbmR3DJ4AaABAg,"Many, many thanks, Jamie! I appreciate it so much!!Best regards to you,Volker L. H. :)"
255,UgycbHoeba0lME84uKJ4AaABAg,ooS0Hop_zhk,"Romulan Admiral Mendak: ""I suggest you leave... Now!"" (""Star Trek: TNG"" Season 4 episode ""Data's Day"")"
256,UgycbHoeba0lME84uKJ4AaABAg.8YuzCyJc3E78lib9p8ayIt,UgycbHoeba0lME84uKJ4AaABAg,Then this anthem plays with a fleet of Romulan ships approaching which forces Picard and the Enterprise to retreat!
257,UgyehX5QvzBNKKOksHN4AaABAg,ooS0Hop_zhk,"I wonder what ""Deridex"" means, since this is also the name of the most powerful class of Romulan warbird? It seems like it means something like ""sword"" or maybe ""warrior""."
258,UgyehX5QvzBNKKOksHN4AaABAg.8Yl0zsw5Y9c8Yr7p1eQS-l,UgyehX5QvzBNKKOksHN4AaABAg,"""Deridex"" simply means ""Empire"". I would say, that most Romulan warbirds are from the ""Empire""-class. :)"
259,UgxAQjuRfIO2eISUE7Z4AaABAg,ooS0Hop_zhk,Sounds like Latin and marching Roman Legions!!
260,UgxAQjuRfIO2eISUE7Z4AaABAg.8YBxztvE07l8YDGuXgZebX,UgxAQjuRfIO2eISUE7Z4AaABAg,"Yes, that is intention! I called it proto-romulan! (mixed language between ""latin"" and ""romulan""... :)"
261,Ugz__nf8nFcY2h69rz94AaABAg,ooS0Hop_zhk,Any true human would side with Romulus. Imperial blood unties us.
262,Ugxuks9areyY7kbyiO94AaABAg,ooS0Hop_zhk,I see the Romulan Winged Defender..The Most awesome Ship ever created!! Hail The Praetor!
263,UgyyS_aRM-pm5WirSfx4AaABAg,ooS0Hop_zhk,Jolan Tru
264,UgyyS_aRM-pm5WirSfx4AaABAg.8Wro514C6wj8Wvg0T1RG2N,UgyyS_aRM-pm5WirSfx4AaABAg,"Thanks, Mike! Jolan Tru!"
265,Ugzaw3Di6cx2B_rdSb54AaABAg,ooS0Hop_zhk,listens at normal speed the fleet is on approachlistens at 1.25 speed the fleet has engaged the enemy
266,Ugzaw3Di6cx2B_rdSb54AaABAg.8WMHwOoqsHq8WOmtUcgSLT,Ugzaw3Di6cx2B_rdSb54AaABAg,"Ha, ha, that's cool, Berggeist!! I appreciate it so much!Best regards to you,Volker L. H. ;)"
267,Ugz_ka1IEr8STnUJN6N4AaABAg,ooS0Hop_zhk,"let your courage guide you, let your wings carry and let your guns protect you"
268,Ugz_ka1IEr8STnUJN6N4AaABAg.8VpSu71-Uth8fOA5f82pHF,Ugz_ka1IEr8STnUJN6N4AaABAg,HMS Renown yes
269,Ugz_ka1IEr8STnUJN6N4AaABAg.8VpSu71-Uth8cjdqXpJ57t,Ugz_ka1IEr8STnUJN6N4AaABAg,And don't forget about the cloaking device.
270,UggmtZqPGgYzFHgCoAEC,ooS0Hop_zhk,Dieses Lied der Romulaner würdig.
271,UggmtZqPGgYzFHgCoAEC.8VPfpk2dhqK8VPhcY9NN_W,UggmtZqPGgYzFHgCoAEC,"Vielen Dank, Wotan! :)"
272,UghhuKzGh15Un3gCoAEC,ooS0Hop_zhk,"Eres un crack, sigues haciendo muy buenas piezas."
273,UghhuKzGh15Un3gCoAEC.8UnXjIwbrWZ8UndV11bhvH,UghhuKzGh15Un3gCoAEC,"¡ Gracias, querido amigo por su buen comentario! ¡Estoy muy contento!Un montón de saludos desde Alemania,Volker H. :)"
274,Ugg8Od9r-La0OXgCoAEC,ooS0Hop_zhk,Glory to my made up Romuluan Star Empire!!
275,UgjxRLOsdO2h5HgCoAEC,ooS0Hop_zhk,"Sogar 14 Fans aus Australien...?Da arbeite ich auch noch fieberhaft dran;-)!EverHALG, Maestro!"
276,UgjxRLOsdO2h5HgCoAEC.8TEitmyANgo8THFmhbeZd0,UgjxRLOsdO2h5HgCoAEC,"Haha, d e r war jetzt guuut!! ...Eeeer nu' wiedaaa!!! ;)))))))))))))))"
277,UgjxRLOsdO2h5HgCoAEC.8TEitmyANgo8THEqYPM1YE,UgjxRLOsdO2h5HgCoAEC,Deren 'Daumen runter' wäre also was hier (oben)...?
278,UgjxRLOsdO2h5HgCoAEC.8TEitmyANgo8THCbjBYcKf,UgjxRLOsdO2h5HgCoAEC,"Wirklich keine Ahnung, was Du meinst, lieber JM! ""Land Down Under"" oder ""Down Under"" war höchstens mal'n ganz bekannter Welthit einer australischen Band, das war mir noch geläufig..."
279,UgjxRLOsdO2h5HgCoAEC.8TEitmyANgo8TH8gvMSfp9,UgjxRLOsdO2h5HgCoAEC,"Na, from the 'land down under' eben, lieber Volker. Quasi auf dem Kopf sozusagen..."
280,UgjxRLOsdO2h5HgCoAEC.8TEitmyANgo8TH3Adu5GL-,UgjxRLOsdO2h5HgCoAEC,"Was, 14 Fans aus Australien? Ich wusste ja nicht, dass Australien überhaupt so viele Einwohner hat. ;)) Andererseits weiß ich, dass ein ""Daumen hoch"" in diesem genannten Land als nicht besonders schicklich gilt (kein Witz!).Lasse mich doch mal teilhaben, um zu verstehen, lieber JM - bin heute saudoof!From owl2owl,Follkaaaaaaaaaaa ;)))))"
281,UghBwR5H1cHyhXgCoAEC,ooS0Hop_zhk,k keep up the good work love it and at 0 51 what class of ship is that and remember  hail the roumlan empire let all fall under the banner of Romulus and remus 
282,UghBwR5H1cHyhXgCoAEC.8SZiUFziySn9-cS8UCVZQW,UghBwR5H1cHyhXgCoAEC,"@Volker400 Ar'kif is one of the Warbird types in Star Trek Online,if I recall correctly."
283,UghBwR5H1cHyhXgCoAEC.8SZiUFziySn8S_denaDJYE,UghBwR5H1cHyhXgCoAEC,"Many thanks, DD, for your fine comment! The ship at 0:51 is the so called ""Ar'Kif class tactical warbird"".Thanks again and best regards to you,Volker L. H. :)"
284,UggXJdfgH8h8E3gCoAEC,ooS0Hop_zhk,is there sheet music
285,UggXJdfgH8h8E3gCoAEC.8SU82rJfFGs8SXYAXkU5jv,UggXJdfgH8h8E3gCoAEC,"Not for the public, Tara."
286,UghRXBfPIM6DOHgCoAEC,ooS0Hop_zhk,Is this in Latin?
287,UghRXBfPIM6DOHgCoAEC.8RH49LnN0Ww8RMr-DgUEx6,UghRXBfPIM6DOHgCoAEC,"Not really, EFJ. This is a kind of ""quasi-latin"".Thanks so much for your question!Best regards to you,Volker L. H. :)"
288,UgiSfUiMm0TJ9HgCoAEC,ooS0Hop_zhk,"when I finally have all 3 scimitar class ships in STO One will be named Mol'Rihan as I have done before, the other two named for D'Tan and Obisek."
289,UgiSfUiMm0TJ9HgCoAEC.8QmD54zprH-8zzCPGNoksI,UgiSfUiMm0TJ9HgCoAEC,Although naming the other two Memory of Ch'Rihan and Memory of Ch'Havran is good too!
290,Uggl-fs2ynt48HgCoAEC,ooS0Hop_zhk,I will say this: Proconsul D'Tan and his followers are people of sterling character!
291,UghzEGdXPqYrMHgCoAEC,ooS0Hop_zhk,And Health to Obisek of the Remans!
292,UggrNu-lAvt8KXgCoAEC,ooS0Hop_zhk,Death to Sela! Death to Hakeev! Death to the Elachi! Health to D'Tan! Prosperity to Mol'Rihan! Prosperity to The Romulan Republic!
293,UggrNu-lAvt8KXgCoAEC.8OEuud5zZ-E98SkYrTu8Yi,UggrNu-lAvt8KXgCoAEC,@Das Vadder  Tal Shiar apologist
294,UggrNu-lAvt8KXgCoAEC.8OEuud5zZ-E98SgNGt8nE-,UggrNu-lAvt8KXgCoAEC,Traitor
295,UggrNu-lAvt8KXgCoAEC.8OEuud5zZ-E8zxEbU3F9_n,UggrNu-lAvt8KXgCoAEC,"Let the Phoenix perch upon our banners as it decorates our flag,clutching lost Romulus and Remus, cradling Mol'Rihan in it's wings."
296,UggrNu-lAvt8KXgCoAEC.8OEuud5zZ-E8pyTiYAibW9,UggrNu-lAvt8KXgCoAEC,"@Bruno LeCathare Don't bank on something ever happening to D'Tan.He is wise as a serpent,yet gentle as a dove. Spock was wise choosing him as his right hand man,much as Jesus Christ was wise in choosing Simon Peter as his right hand man."
297,UggrNu-lAvt8KXgCoAEC.8OEuud5zZ-E8oghRVKI7WI,UggrNu-lAvt8KXgCoAEC,"So say we,......so say we all  emoji_winking_face "
298,UggrNu-lAvt8KXgCoAEC.8OEuud5zZ-E8luWNe3VPk4,UggrNu-lAvt8KXgCoAEC,"The Republic is for now useful as both a rally point and a way to cleaning the house from opportunists and lunatics in the Senate, Army and Intelligence, who would sell their own blood to solanogen scum for a vague promise of Iconian power. Still, those are not ways for our people, and you can bet a new Empire will rise, from Romulans to Romulans, that will carry forward our rightful pride and superiority. D'Tan has been a very useful leader, but if he gets carried too far out with his foreign Federation-inspired idealism, one can foresee he will one day fall ill to an unfortunate and accidental radiation poisoning and deemed permanently incapacitated."
299,UggrNu-lAvt8KXgCoAEC.8OEuud5zZ-E8libQjIMWIt,UggrNu-lAvt8KXgCoAEC,redeagle321  Hell yeah! Payback for destroying Romulus and Remus and for trying to wipe us out for Sela's actions.
300,UggrNu-lAvt8KXgCoAEC.8OEuud5zZ-E8jsPR_9CthF,UggrNu-lAvt8KXgCoAEC,redeagle321 ikr
301,UggrNu-lAvt8KXgCoAEC.8OEuud5zZ-E8jsN5IvG47e,UggrNu-lAvt8KXgCoAEC,And a big fat Plasma torpedo for the Iconians while we're at it!
302,UggrNu-lAvt8KXgCoAEC.8OEuud5zZ-E8hhHTgyLIxM,UggrNu-lAvt8KXgCoAEC,"To echo aragorn...A day may come when the world of the Rihannsu comes crashing down but it is not this day. This day we fight! In the name of all you hold dear on this New Romulus, I bid you stand,men of Romulus and Remus!"
303,UggrNu-lAvt8KXgCoAEC.8OEuud5zZ-E8h7joIxlVbA,UggrNu-lAvt8KXgCoAEC,"You forgot, death to tyranny and tal shiar!"
304,UggrNu-lAvt8KXgCoAEC.8OEuud5zZ-E8_2bo37aOfR,UggrNu-lAvt8KXgCoAEC,"Actually, it was Sela, but it was not intentional."
305,UggrNu-lAvt8KXgCoAEC.8OEuud5zZ-E8YZ3xi0EeZd,UggrNu-lAvt8KXgCoAEC,"Don't forget about Taris. She may have been duped, but she still was responsible for the annihilation of the homeworlds."
306,UggrNu-lAvt8KXgCoAEC.8OEuud5zZ-E8PD051PzGge,UggrNu-lAvt8KXgCoAEC,"And Health to Obisek, Remans are good people too!"
307,Ugh8jXv0U4sPiHgCoAEC,ooS0Hop_zhk,I like this... its good music!
308,Ugh8jXv0U4sPiHgCoAEC.8NkNiXb3QH58Nkc4Sdv-GE,Ugh8jXv0U4sPiHgCoAEC,"Thanks so much, Shep, for your very fine comment!! So happy you enjoyed. I appeciate it!!Best regards to you,Volker L. H. :)"
309,Ughg3wdAgNwmXngCoAEC,ooS0Hop_zhk,Nice to see so many Romulan space ships.
310,Ughg3wdAgNwmXngCoAEC.8NGh5eJ3n9m9iQaycR3Dev,Ughg3wdAgNwmXngCoAEC,NOOOOOOOOOOOOOOOOOOOOOOOOOOOOOOOOOOOOOOOOOOOOOOOOOOPE
311,Ughg3wdAgNwmXngCoAEC.8NGh5eJ3n9m9-cRR0iPMym,Ughg3wdAgNwmXngCoAEC,@Luis Velázquez the Republic is allied to the Federation and the Klingon empire.
312,Ughg3wdAgNwmXngCoAEC.8NGh5eJ3n9m8pQos1BIbFS,Ughg3wdAgNwmXngCoAEC,Hopefully the next movie they will show more romulan ships and Remus together fighting against the federation or other races  emoji_eagle 
313,Ughg3wdAgNwmXngCoAEC.8NGh5eJ3n9m8NJSN2kgiUf,Ughg3wdAgNwmXngCoAEC,"More than welcome, Björn! :)"
314,Ugi1XL0QiOS-sngCoAEC,ooS0Hop_zhk,"I loved this, again, nice work!"
315,Ugi1XL0QiOS-sngCoAEC.8NAKE0mE9MU8NJSOFBHE3E,Ugi1XL0QiOS-sngCoAEC,"Aaand thanks so much, Nickolas!! :)"
316,UgiL7Qq3O2rqlHgCoAEC,ooS0Hop_zhk,The Romulan Space Fleet March & The Romulan Anthem are excellent for listening to while I'm studying. Thanks for these xx
317,UghJozFQZbTp43gCoAEC,ooS0Hop_zhk,Excuse me sir/mam/attack helicopter do you have super powers? Because this is some badass music
318,UghJozFQZbTp43gCoAEC.8MIUUa-k72J8MIn2hjHuYB,UghJozFQZbTp43gCoAEC,"ThaaaaanX(XXL) so much for your badass comment! ;)))))I appeciate it!Best regards to you,Volker L. H. :)"
319,Ugh5092p5_pDLngCoAEC,ooS0Hop_zhk,Now do one with actual Romulan! <:http://www.rihan.org/drupal/lessons/introduction
320,Ugh5092p5_pDLngCoAEC.8Eut8N880mz8LCLzh3xq1e,Ugh5092p5_pDLngCoAEC,YES!
321,Uggmu4TVsUBQlXgCoAEC,ooS0Hop_zhk,Borg is the best
322,UgjpLzaVI9cvq3gCoAEC,ooS0Hop_zhk,wanna hear a starfleet march
323,UgjpLzaVI9cvq3gCoAEC.8Ek68pY-UzR8fmfhQH2rdb,UgjpLzaVI9cvq3gCoAEC,Sure!
324,Ugh8CAyT5goHg3gCoAEC,ooS0Hop_zhk,"Ok so I'm not a huge Star Trek fan and I don't know the background to any of these cultures but can someone tell me why Remus and Romulus are so important for this species? Last time I checked, the Roman Empire didn't expand into space (unfortunately)"
325,Ugh8CAyT5goHg3gCoAEC.8D71PiUcPXH8Imbu4w28oA,Ugh8CAyT5goHg3gCoAEC,hi
326,Ugh8CAyT5goHg3gCoAEC.8D71PiUcPXH8ImbqvU40ST,Ugh8CAyT5goHg3gCoAEC,j
327,Ugh8CAyT5goHg3gCoAEC.8D71PiUcPXH8HNm15QwYoC,Ugh8CAyT5goHg3gCoAEC,"+Bini Farmer Actually Romulus (Ch'Rihan in the Romulan language) and Remus (Ch'Havran) are two separate planets in the same star system. Like Earth and Mars. Only Romulus and Remus orbit close enough to each other that either one can be easily seen (continents, oceans and all) from the other's surface."
328,Ugh8CAyT5goHg3gCoAEC.8D71PiUcPXH8ETrdkKLufN,Ugh8CAyT5goHg3gCoAEC,"Romulus is the name for their home world, and Remus is its moon."
329,Ugh8CAyT5goHg3gCoAEC.8D71PiUcPXH8DPOFkT2hhh,Ugh8CAyT5goHg3gCoAEC,"+Superorganismus Romulus is the English name of the primary planet of the Romulan Star Empire (no connection to the Romans), and Remus is another inhabited planet in the same system. They're known in Romulan (in Volker's songs, at least) as ""Rihan"" and ""Havran""."
330,Ughe9pTpiIEaU3gCoAEC,ooS0Hop_zhk,What is the melody?
331,Ughe9pTpiIEaU3gCoAEC.8C7jRoZgKIm8C8-0ROBmwj,Ughe9pTpiIEaU3gCoAEC,"+41st Omega No, I'm so sorry, dear 41st Omega. There is no sort of ""playback"" or instrumental version without the song text.Btw, many thanks for your interest!!Best regards to you,Volker H. :)"
332,Ughe9pTpiIEaU3gCoAEC.8C7jRoZgKIm8C7tfJuBqk0,Ughe9pTpiIEaU3gCoAEC,@Volker400 Is there any way I could acquire it without the words?
333,Ughe9pTpiIEaU3gCoAEC.8C7jRoZgKIm8C7rjSc5Vdd,Ughe9pTpiIEaU3gCoAEC,+41st Omega It's completely composed (partially improvised!) by myself!!
334,Ugj9U3Khb3GBQngCoAEC,ooS0Hop_zhk,"Why is it that the Romulans speak a language related to Latin?  I would think since the R. appear superficiallyas a mix of Arab and East-Siberian (=American Indian), only with pointed ears and a bit of bony structure on the forehead, wouldn't a fitting language for them be an adaptation of a mix of Arabic and Nivkh, the languageof a tribe that lives on the island of Sakhalin?"
