,id,Recipient (video or comment),comment
1,Ugx9_uzJlYnUSFwem4J4AaABAg,te57eTi1mS4,Díganme que no entendieron nada porque yo no
2,UgyVLjEMkeVAvErlXjp4AaABAg,te57eTi1mS4,ROMULO ERES MUY MALO CON TU HERMANO
3,UgzEM_tdhhiDjwpR_WV4AaABAg,te57eTi1mS4,jajajjaa
4,UgyBXK3i7Owy2tqVMBN4AaABAg,te57eTi1mS4,me traume :)
5,UgwFZ2PMHkHPn5KZSGZ4AaABAg,te57eTi1mS4,Parece south park lol.
6,UgyYRfZee7RVqGtLVZV4AaABAg,te57eTi1mS4,"Qué buen vídeo para la gente a la que le interesa el vídeo le entiende perfectamente pero a la gente que no le importa ni por tanto no le entiende ni por un comino, gracias por el vídeo me ha servido de mucha ayuda  emoji_face_with_tears_of_joy "
7,Ugw92nd7vdl-Z8Sff_l4AaABAg,te57eTi1mS4,Copywright usaste le Canción de star wars
8,UggcKVv1Atoex3gCoAEC,te57eTi1mS4,iuhnhinunhuiiuhnhnunuhiuh iuh niuhuinu  / pero sera hijo de tiiiiiiiiiiiiiiiiiiiiiiiiiiit/
9,UggxuAcYatjZPngCoAEC,te57eTi1mS4,Como e acabado aqui?
10,Ugg7PNA4zgR_X3gCoAEC,te57eTi1mS4,para eso veo mis videos mejor  emoji_beaming_face_with_smiling_eyes  emoji_beaming_face_with_smiling_eyes  emoji_beaming_face_with_smiling_eyes  emoji_beaming_face_with_smiling_eyes  emoji_smiling_face_with_halo  emoji_smiling_face_with_halo  emoji_smiling_face_with_halo  emoji_smiling_face_with_halo  emoji_smiling_face_with_halo  emoji_smiling_face_with_halo  emoji_smiling_face_with_halo  emoji_face_with_tongue  emoji_face_with_tongue  emoji_face_with_tongue  emoji_face_with_tongue  emoji_face_with_tongue  emoji_face_with_tongue  emoji_grinning_squinting_face  emoji_grinning_squinting_face  emoji_smiling_face_with_sunglasses  emoji_smiling_face_with_sunglasses  emoji_smiling_face_with_sunglasses 
11,Ugix9qU0zUsn2XgCoAEC,te57eTi1mS4,no entendí ni una mieda
12,Ugi0PU7kweg_wXgCoAEC,te57eTi1mS4,vale mierda este video andate vales kaka
13,UgjBPNP9TvBsf3gCoAEC,te57eTi1mS4,que mierda no entendí nada.
14,Ugjj9iEyg2XpqXgCoAEC,te57eTi1mS4,"Muy buen vídeo... Por desgracia le di dislike, pero fue sin intención, bueno, más o menos. :v"
15,Ugjj9iEyg2XpqXgCoAEC.8A-pvN29tOx9Jq7boP1IJ4,Ugjj9iEyg2XpqXgCoAEC,:V
16,UgjGoHKK3RIvKXgCoAEC,te57eTi1mS4,es una puta mierda de video una puta mierda jajajajajajjajjaja
17,UgjGoHKK3RIvKXgCoAEC.86fUHgctpq68eZBJoWhbUi,UgjGoHKK3RIvKXgCoAEC,Idiotas
18,UgjGoHKK3RIvKXgCoAEC.86fUHgctpq6871dQYTx2hx,UgjGoHKK3RIvKXgCoAEC,no no es una puta mierda una reputa remierda  emoji_face_with_tears_of_joy 
19,UghVZAS1OqNYvXgCoAEC,te57eTi1mS4,Osea usaron audios de una parodia de Dragon Ball Z dejate de joder
20,Ugis4eU1ZL2lb3gCoAEC,te57eTi1mS4,remulo fue malo al matar a su hermano
21,Ugis4eU1ZL2lb3gCoAEC.85VaYtiIWr79BBAuunbinV,Ugis4eU1ZL2lb3gCoAEC,ESTOY DEACUERDO CON  ELLA
22,Ugh-0T7ZdCM8DXgCoAEC,te57eTi1mS4,FNAF 4 SONG XD
23,Ugh-0T7ZdCM8DXgCoAEC.853cvwioTdg8eZBOGigWgT,Ugh-0T7ZdCM8DXgCoAEC,Eso que?
24,Ugi4cHeGpGBqOHgCoAEC,te57eTi1mS4,muy malo no entendi nada
25,Ugi4cHeGpGBqOHgCoAEC.82HQAGeYtrU8eZBFgXJslZ,Ugi4cHeGpGBqOHgCoAEC,Pues será que no le pusiste atención
26,Ugi4cHeGpGBqOHgCoAEC.82HQAGeYtrU871dXSHkXE2,Ugi4cHeGpGBqOHgCoAEC,dimelo a mi jajajajjaja
27,UgiidckFreMAJngCoAEC,te57eTi1mS4, emoji_kiss 
28,UggzRx0elqU473gCoAEC,te57eTi1mS4,pues vaya mierda de video
29,UgjTgR9iEM4n_HgCoAEC,te57eTi1mS4,Que grosero 
30,UgjzoGM2hIw6vngCoAEC,te57eTi1mS4,Romulo no mato a Remo
31,UghgiNlYPUGhk3gCoAEC,te57eTi1mS4,muy diver garcias haora lo entiendo
32,UghgiNlYPUGhk3gCoAEC.7-H0Z7-DLNR70Jrz-XVpT-,UghgiNlYPUGhk3gCoAEC,si es malisimo esta mal hecho y encima no sabes escribir
33,UgiHcodk-A88EHgCoAEC,te57eTi1mS4,"Que terrible, no la narran bien."
34,UgiHcodk-A88EHgCoAEC.7-H0Z7-2Ar871YEkRq_M9-,UgiHcodk-A88EHgCoAEC,tienes toda la razon
35,UgjjmZlEVbLQQHgCoAEC,te57eTi1mS4,"Lol.No sé si ponerle ""me gusta"" o ""no me gusta""."
36,UgjjmZlEVbLQQHgCoAEC.7-H0Z7-Skdu9Jq7_7NosKt,UgjjmZlEVbLQQHgCoAEC,xd
37,UgjjmZlEVbLQQHgCoAEC.7-H0Z7-Skdu878pz_OB3Yw,UgjjmZlEVbLQQHgCoAEC,"Jajajaja :v lo haría, pero se esforzó xD"
38,UgjjmZlEVbLQQHgCoAEC.7-H0Z7-Skdu871df2mNox_,UgjjmZlEVbLQQHgCoAEC,no me gusta jajajajjajaja aseme caso es malisimo
39,UgiFPbngHDpVN3gCoAEC,te57eTi1mS4,buenisimo lo entendi al toque ...
40,UgiFPbngHDpVN3gCoAEC.7-H0Z7-8S5j8n9NZhmtEcg,UgiFPbngHDpVN3gCoAEC,Aber de qhe emoji_face_savoring_food 
41,Ugh3b0_1_tc2M3gCoAEC,te57eTi1mS4,molan los personajes
42,UggPwXY89gQMLHgCoAEC,te57eTi1mS4,mola
43,Ugj8v3YIu9desngCoAEC,te57eTi1mS4,xd xd xd xd
44,UgipL6AFQvTPUXgCoAEC,te57eTi1mS4,"jajajaj es muy graciosa, esto es broma idiotas es para reirse un poco, no se tomen todo tan enserio"
45,UgipL6AFQvTPUXgCoAEC.7-H0Z7--gRe871dmTUqLSJ,UgipL6AFQvTPUXgCoAEC,no lo pense asi pero aun asi es un video malo jajajaja
46,Ughv7Cj2fwepGXgCoAEC,te57eTi1mS4,no es muy bueno
47,UggRhNzicP-p5XgCoAEC,te57eTi1mS4,mala la wea
48,UghdaPqCmTAYmHgCoAEC,te57eTi1mS4,"La verdad esta muy buena y muy bien resumida la historia de como se hizo roma (Leyenda) la gente qe dice q es mala es por que no se sabe la verdadera historia, Felicitaciones ;)"
49,UgxVdtP1pTI0XzTvfat4AaABAg,te57eTi1mS4,q putada tan mala
50,Ugw0_zWH-5NiE8W7tT94AaABAg,te57eTi1mS4,"Es buenísimo!!! Gracias!! En clase de latín lo hemos pasado dos veces, mercii!"
51,UgzDAHm0rhNdMN8SJRR4AaABAg,te57eTi1mS4,Regular
52,UgwMsSFcBJjzWKGqfb14AaABAg,te57eTi1mS4,@mm muhhjjl jm @@
53,UgzJ0Q_Z9yeZ6--auYl4AaABAg,te57eTi1mS4,la wea mas mala que he visto
54,Ugwdm7M1z3LSZGXI2UN4AaABAg,te57eTi1mS4,"xd
"
55,Ugyb_Eu-93kBhghEt2h4AaABAg,te57eTi1mS4,Valla kk
56,Ugzl065wCcBDZbDxi-t4AaABAg,te57eTi1mS4,jajjajajajajja se la violaronnn?? s ctm que mme rei wnnnnn
57,UgyWwVFS4hA4i5yq-uJ4AaABAg,te57eTi1mS4,"Lo necesitaba era para una tarea me gusto porque era en dibujos pero que orror yo no necesitaba las grocerias
"
58,UgznJnXmut8FpPh6vwN4AaABAg,te57eTi1mS4,"Es Muy brebe , pero igual bien"
59,Ugyg7Jgm8rPUOl6D15Z4AaABAg,te57eTi1mS4,"PESIMO!!!!!
"
60,Ugy2GS8ErapXsrgoewJ4AaABAg,_Sr5acdItG8, emoji_thumbs_up_light_skin_tone 
61,UgwjlBOr79V4-jjY3th4AaABAg,_Sr5acdItG8,"Hi, ich würde mich sehr über ein paar Tipps freuen. emoji_slightly_smiling_face "
62,Ugz1dkMjAzAmfc08rFN4AaABAg,r49UF4GvGGg,did you use a picture of the great daku tree from legends of zelda lol
63,UgzE2uN01iXHEeYS2Ed4AaABAg,r49UF4GvGGg,I really love this channel! Keep up the good work  emoji_red_heart 
64,Ugzu4KNZx_pxXiDeh-N4AaABAg,r49UF4GvGGg,"""Each war contains all earlier wars.""[The Human Province, Elias Canetti, 1973, English Edition, 1978, Sec. ""1951“]"
65,UgyQYgrTmd-QwU0eYIx4AaABAg,r49UF4GvGGg,"""The war divided people into two parties:one absolutely warlike, the other absolutely peaceful. The former continues the war in plans of revenge; the latter celebrates reconciliation long before winning.""[The Human Province, Elias Canetti, 1973, English Edition, 1978, Sec. ""1943“]"
66,UgySmnfgEJzZ4z93Os54AaABAg,r49UF4GvGGg,"Of all human religion, war is the most tenacious; but it too can be disbanded.[The Human Province, Elias Canetti, 1973, English Edition, 1978, Sec. ""1942“]"
67,Ugzh5PIpSENqSwCPyRZ4AaABAg,r49UF4GvGGg,This is the violent origins of war.The Nephalim taught man to extract metals from the ground to make armour and swords and spears.Then they taught them how to go to war.And have been laughing at the morons ever since.
68,UgwqHUMFr00dV5abO0B4AaABAg,r49UF4GvGGg,Hopefully Netflix does more of this program
69,UgxYPtLBrTGBr5NlYEx4AaABAg,r49UF4GvGGg,This is on Netflix now Monsters and Myths
70,UgyPb0aIipvMojJkaCF4AaABAg,r49UF4GvGGg,Love watching documentaries like this
71,Ugx4B9-UrG_ZmJsnRoB4AaABAg,r49UF4GvGGg,Excellent documentary  emoji_clapping_hands  emoji_clapping_hands  emoji_clapping_hands  emoji_clapping_hands 
72,Ugwkg8rQInwyxgKXIGB4AaABAg,r49UF4GvGGg,So nice the way of how history is presented... Like a fairytale.  emoji_sparkles  emoji_dizzy  emoji_blue_heart  emoji_white_heart  emoji_red_heart  emoji_star-struck 
73,UgzMaxf-lN7TEFptbJ14AaABAg,r49UF4GvGGg,"First off, Respect to the excellent 3D graphics  emoji_OK_hand "
74,UgzXhzamJlrCMBKumQB4AaABAg,r49UF4GvGGg,Release the Kraken!
75,UgwtDpcnQ8KxmHwSrpl4AaABAg,r49UF4GvGGg,God i love documentaries like this.Good job keep up the good work.
76,UgzK9oIfqVPwRPjf-7x4AaABAg,r49UF4GvGGg,"1,830th!.."
77,UgzK9oIfqVPwRPjf-7x4AaABAg.9eh0ctzWLQz9epjBi795IA,UgzK9oIfqVPwRPjf-7x4AaABAg, emoji_face_with_tears_of_joy  emoji_face_with_tears_of_joy  emoji_face_with_tears_of_joy 11.176th  emoji_winking_face 
78,UgxEqmAp0Hx8k3AEid54AaABAg,r49UF4GvGGg,"Even with the economic Inflation emoji_weary_face  I'm very excited to have earned $10,250 on my $4,000 investment every 13 days  emoji_smiling_face_with_smiling_eyes "
79,UgxEqmAp0Hx8k3AEid54AaABAg.9egy_5z9WRH9fDQhQHZYKu,UgxEqmAp0Hx8k3AEid54AaABAg,Lmfaooo yoo that was totally believable! I definitely don’t think you’re the same person taking to yourself..definitely not.  emoji_face_with_tears_of_joy  emoji_face_with_tears_of_joy  emoji_woman_facepalming 
80,UgxEqmAp0Hx8k3AEid54AaABAg.9egy_5z9WRH9emBSazXiVd,UgxEqmAp0Hx8k3AEid54AaABAg,"Lmao what a natural, totally real and not fake at all, convenient y'all are having!!"
81,UgxEqmAp0Hx8k3AEid54AaABAg.9egy_5z9WRH9ehMsjKAwYN,UgxEqmAp0Hx8k3AEid54AaABAg,Is anyone stupid enough to fall for this con?
82,UgxEqmAp0Hx8k3AEid54AaABAg.9egy_5z9WRH9eh3AQSRJ8L,UgxEqmAp0Hx8k3AEid54AaABAg,"KainWarwick strategies are the top notch. I make my profits every week , made $9,130 last week."
83,UgxEqmAp0Hx8k3AEid54AaABAg.9egy_5z9WRH9eh2Ya_jrz6,UgxEqmAp0Hx8k3AEid54AaABAg,"I invest with him too, i make about a $7,000 weekly."
84,UgxEqmAp0Hx8k3AEid54AaABAg.9egy_5z9WRH9eh2BEG9sWA,UgxEqmAp0Hx8k3AEid54AaABAg,"KainWarwick is the only one I can leave my investment with and think less about it, he is my money maker.  I just received 24,300 of my investment last month.  I am very happy because he is leading me to financial freedom."
85,UgxEqmAp0Hx8k3AEid54AaABAg.9egy_5z9WRH9eh1qzSZIXI,UgxEqmAp0Hx8k3AEid54AaABAg,Trust me you won't regret trading with Mr Kain Warwick
86,UgxEqmAp0Hx8k3AEid54AaABAg.9egy_5z9WRH9eh1e8O8K3E,UgxEqmAp0Hx8k3AEid54AaABAg,THANKS A LOT I WILL CONTACT HIM RIGHT AWAY
87,UgxEqmAp0Hx8k3AEid54AaABAg.9egy_5z9WRH9eh17_eFrzI,UgxEqmAp0Hx8k3AEid54AaABAg,Please how can I reach out to Mr Kain warwick ? I urgently need his management on my INVESTMENTS !
88,UgxEqmAp0Hx8k3AEid54AaABAg.9egy_5z9WRH9eh-XfobK4P,UgxEqmAp0Hx8k3AEid54AaABAg,"I invested with Expert Kain warwick, he's the best."
89,UgxEqmAp0Hx8k3AEid54AaABAg.9egy_5z9WRH9eh-BXMbeCw,UgxEqmAp0Hx8k3AEid54AaABAg,How?
90,Ugzf10NJWReMNM5L9Eh4AaABAg,r49UF4GvGGg,Isn't this title a needless tautology? War is itself just a manifestation of violence. Is there anyone who thought there was such a thing as a peaceful origin of war before they watched this video?
91,Ugzf10NJWReMNM5L9Eh4AaABAg.9eghMWo_Waj9epj41KNP4t,Ugzf10NJWReMNM5L9Eh4AaABAg,Maybe they wanted to emphasize that.  emoji_thinking_face  emoji_person_shrugging 
92,Ugzf10NJWReMNM5L9Eh4AaABAg.9eghMWo_Waj9eh5L6kBB8u,Ugzf10NJWReMNM5L9Eh4AaABAg,"Yes, most idiots."
93,UgyMMVQHmnGTXTIqzJ94AaABAg,r49UF4GvGGg,We human can still learn from these myth.  emoji_backhand_index_pointing_left 
94,UgxNZEDiJdowL4SxC1R4AaABAg,r49UF4GvGGg,Second  emoji_2nd_place_medal 
95,UgxNZEDiJdowL4SxC1R4AaABAg.9egDNQw002F9egFsCc759t,UgxNZEDiJdowL4SxC1R4AaABAg,Appreciated ! Write me using the digit added to my name okay.......
96,UgyBjdM4M-6HLR5lGid4AaABAg,r49UF4GvGGg,First!
97,UgzRvYbNK9HiRgyAHdZ4AaABAg,wvfk1WVNpbk,Nautical drawings
98,Ugxxcm-nS_GEAaHGkc54AaABAg,wvfk1WVNpbk,U drew tht?
99,UgySjv2oFHqlmIdI10N4AaABAg,FJH1ilPdOa0,Roll your r when speaking Latin it should sound like a dog. Oh and Wolfs are animals of Mars Romulus and Remus's father
100,UgxZkqF_pNHsZV-UPF14AaABAg,FJH1ilPdOa0,Nice
101,UgxedBthYCS720zobx14AaABAg,8idmFyMlWrE,Show me more!
102,UgxcBO7rmblJ89PsixN4AaABAg,dc3KveLUfq0,Only 13 views ?This video have less views than a reposted video i can not believe that
103,UgxcBO7rmblJ89PsixN4AaABAg.9NN2RGJN66Z9NNp8DBZYzh,UgxcBO7rmblJ89PsixN4AaABAg,Yes sad
104,UgyufxyMxF-G8FjEj454AaABAg,dc3KveLUfq0,This so sussy from red Imposter this video  emoji_flushed_face 
105,UgzVxihg04cQ7lYMGhh4AaABAg,12V3cA39Ny8,Long live the Roman empire!
106,Ugze4V1GYD2QPSwEp_p4AaABAg,12V3cA39Ny8,Based and Roman pilled
107,Ugy-waON5QEwh1P3Ew14AaABAg,ooS0Hop_zhk,When you find out Italy has a functioning space agency
108,UgwHcMhDM28VjUa-Pg14AaABAg,ooS0Hop_zhk,Don't trust an Romulanian
109,UgzovrAIKTO6ugBv5294AaABAg,ooS0Hop_zhk,My friend is thinking about making animations and you know what I’m sending to her if she makes a Rome inspired one
110,UgzovrAIKTO6ugBv5294AaABAg.9iWcrZMyjdL9iZFYclDQf7,UgzovrAIKTO6ugBv5294AaABAg,@Volker400 kool! I will make sure to ask her to put in credit where credit is due! This is my favorite of all! If you have an instrumental of it that would be awesome
111,UgzovrAIKTO6ugBv5294AaABAg.9iWcrZMyjdL9iX71ADvXcF,UgzovrAIKTO6ugBv5294AaABAg,"Your friend must have wanted to use this music, right?Yes, he can use the music for his animation!!!Thank you for your request!Best regards to you,Volker L. H. :)"
112,UgzK1xjXkwC9cfxnm8Z4AaABAg,ooS0Hop_zhk,"""Wait why is the stars playing latin-""(Gets annihilated by a Romulan torpedo)"
113,UgzK1xjXkwC9cfxnm8Z4AaABAg.9iPcu6D58pL9ifMj6nySRI,UgzK1xjXkwC9cfxnm8Z4AaABAg,Lol yes
114,UgxtFu_aYhRQAvatJ0J4AaABAg,ooS0Hop_zhk,Would you mind if I use this in my videos? I'm planing to do some Star trek online videos (with a romulan character) and this'd be perfect for bigger fights and victories!
115,UgxtFu_aYhRQAvatJ0J4AaABAg.9hh3wwF-JIz9hhWPs4Cput,UgxtFu_aYhRQAvatJ0J4AaABAg,"Naturally you can use it!Many thanks for your request.Best regards to you,Volker H.  emoji_slightly_smiling_face "
116,Ugx8H48Tt3S_S5NOEqZ4AaABAg,ooS0Hop_zhk,This sounds like something you’d see in a movie where the characters have just entered a big city and this is playing as the camera flys around the city
117,UgyMn8KIBQhI7PDyyQt4AaABAg,ooS0Hop_zhk,spotify plz?
118,UgzqldzRPrq4mK3Cuad4AaABAg,ooS0Hop_zhk,"The Roman Empire never fell, And went to the stars!!!!!!"
119,Ugy8IXFEB8uzMoh6j5h4AaABAg,ooS0Hop_zhk,Those who brought the dragon wings. The TIMELORDEIN STAR EMPIRE. TIMELORDEA PRIME AND ARLIS PRIME FOR THE GREAT EMPIRE OF JUSTICE  THE LIGHT GUIDE US FOR FREEDOM CHA.VUNA !
120,UgwBa1iKbl6a73N4Tbp4AaABAg,ooS0Hop_zhk,"Imagine you are captain of a small Miranda class vessel or so and open the hailing channels just to be greeted with this... You know you are fucked, because an entire fleet of D´deridex-Warbirds is crossing your way."
121,UgwBa1iKbl6a73N4Tbp4AaABAg.9UqVoM9JOPv9UrsL_fh12_,UgwBa1iKbl6a73N4Tbp4AaABAg,"On the other hand, Warbirds may be larger and stronger than a Galaxy Class ship, but they use to have a weak spot in their arch, right behind the ""beak"". Or you just can blow up their reactors. Romulan singularity reactors are prone to explosions. Or was that the Garidians?"
122,Ugx2W46ctI7w3RyMTil4AaABAg,ooS0Hop_zhk,[Nickname Ghost Gen.Westie Rescue]=====[1] [Lagom] These enemies fight like sick dogs.+-----[⛨]
123,Ugx2W46ctI7w3RyMTil4AaABAg.9TIK0PBQSlu9TKIpVq7y1D,Ugx2W46ctI7w3RyMTil4AaABAg,"[Darth Bane/Apatros/Romulan Emperor -- Highest Leader of the ""Palpatine Dynasty""]You won. You control everything in the Romulan Empire."
124,Ugx2W46ctI7w3RyMTil4AaABAg.9TIK0PBQSlu9TIPO4HX2EX,Ugx2W46ctI7w3RyMTil4AaABAg,"[Darth Bane/Apatros/Romulan Emperor -- Highest Leader of the ""Palpatine Dynasty""]I SWEAR TO JUST TO KEEP AS MUCH OF EMPIRE INTACT AS POSSIBLE! I WILL ESTABLISH PEACE BY ANY MEANS NECESSARY!TAKE YOUR FUCKING-TRIBUTE AND GO HOME! Palpatine's territory is yours for the taking. We will not defend Him, nor, intervene.I SWEAR BY THE BLACKEST VOID THAT KEEPING MY EMPIRE INTACT IS THE HIGHEST IMPERATIVE!"
125,Ugx2W46ctI7w3RyMTil4AaABAg.9TIK0PBQSlu9TIPAWdhHuc,Ugx2W46ctI7w3RyMTil4AaABAg,[1] [Lagom] [Ilmatêr as The Grim Reaper/Death][Lagom] Comment: [Darth Nihilus is weaker than Darth Bane/Apatros/Romulan Emperor.[⛨]
126,Ugx2W46ctI7w3RyMTil4AaABAg.9TIK0PBQSlu9TIMqmPZ1j2,Ugx2W46ctI7w3RyMTil4AaABAg,"[Darth Bane/Apatros/Romulan Emperor -- Highest Leader of the ""Palpatine Dynasty""]THERE IS NO FUCKING DIFFERENCE!I FUCKING SILENCE MYSELF-I!"
127,Ugx2W46ctI7w3RyMTil4AaABAg.9TIK0PBQSlu9TIMa3Ly-w0,Ugx2W46ctI7w3RyMTil4AaABAg,[1] [Lagom] [Sammael-Malphas]=====[⛨]======[_War-and-Peace_-style Russian]=====[⛨] [1] [Lagom] [Sammael'-Mal'fas]=====[⛨]
128,Ugx2W46ctI7w3RyMTil4AaABAg.9TIK0PBQSlu9TIL0Fg5Y3o,Ugx2W46ctI7w3RyMTil4AaABAg,"[Darth Bane/Apatros/Romulan Emperor -- Highest Leader of the ""Palpatine Dynasty"" -- messages relayed from a professional - not possession]We will fight you to the end. TO THE FUCKINIG BLACKEST VOID WITH YOU! 3/7th of MY FUCKING (YES, WE ARE ALL FLUENT IN UNIVERSAL!!!!!) OFFIZIERS THREATENED TO FUCKING SHOOT ME! ROMULUS WILL NOW ENTER CIVIL WAR!Send Lord Malphas to us. Let us negotiate peace. YOU KNOW WHAT FUCK YOU! WE WILL COME FUCKING FOR YOU! THIS IS TOTAL WAR!GRABANAYA CHAST' DER'MA! YA YEBANY NENAVIZHU TEBYA! CHERTOVYY MIR DER'MA! DEN'! DEN'! DEN'! DEN'! DEN'!YA klyanus', chtoby prosto, blyat', istrebit' lyubogo iz moikh ofitserov, kotoryye, blyad', predayut Menya. YA beru samyy chernyy pakt Vechnogo Dukha Pustoty, chtoby ochistit' svoikh sobstvennykh ofitserov.Klyanus', ne ispol'zovat' Blood-Magicks na Federatsii; potomu chto tvoya grebanaya Memorial'naya bol'nitsa isportila moyu voskhititel'nuyu krov'.Klyanus', ne khlamit' Federatsiyu!"
129,Ugyd7EF47QccUJl9OKl4AaABAg,ooS0Hop_zhk,Hey - Can I please somehow obtain the instrumental to this song? I intend to use it...1 for my leisure 2 for a little projectI will credit you in all projects using this amazing music. Thank you in advance!
130,Ugyd7EF47QccUJl9OKl4AaABAg.9Rhogd0naws9XeVO35zkh1,Ugyd7EF47QccUJl9OKl4AaABAg,@Volker400 No best regards to you I listen to it multiple times a day that and the The Romulan Space Fleet March it’s just like wow
131,Ugyd7EF47QccUJl9OKl4AaABAg.9Rhogd0naws9XeUsSrJAh8,Ugyd7EF47QccUJl9OKl4AaABAg,"@Wafalme Thanks so much, Wafahne! I'm happy you enjoyed!I appreciate it very much!Best regards to you,Volker H. :)"
132,Ugyd7EF47QccUJl9OKl4AaABAg.9Rhogd0naws9Xd6am3IYA1,Ugyd7EF47QccUJl9OKl4AaABAg,@Volker400 Man I really love the way how you make the Romulan language sound and the way how the music sound it’s very satisfying
133,Ugyd7EF47QccUJl9OKl4AaABAg.9Rhogd0naws9XcQXT8dcqB,Ugyd7EF47QccUJl9OKl4AaABAg,@Wafalme I'll think about that. Many thanks!
134,Ugyd7EF47QccUJl9OKl4AaABAg.9Rhogd0naws9XZJDh9CYP8,Ugyd7EF47QccUJl9OKl4AaABAg,@Volker400 are you gonna make more Romulan star Empire music if you do can you make one for the Tal shiar
135,Ugyd7EF47QccUJl9OKl4AaABAg.9Rhogd0naws9Rje9vto5xD,Ugyd7EF47QccUJl9OKl4AaABAg,"Unfortunately, a pure instrumental version does not exist! I'm very sorry, dear Raja.   I always worked very economically at that time and put instruments and ""choir"" in a single track.Nethertheless thanks so much, andbest regards to you,Volker L. H. :)"
136,UgwocJ7uZ-Njbo974VR4AaABAg,ooS0Hop_zhk,Is there an instrumental version of this?
137,UgwocJ7uZ-Njbo974VR4AaABAg.9NBa6CakUn69NBaT6YzB4T,UgwocJ7uZ-Njbo974VR4AaABAg,"No, there isn't."
138,UgzXWhBE1QXUAY-Wpqh4AaABAg,ooS0Hop_zhk,I don't remember the Romulans ever having a ship that looked an awful lot like a K'Vort-class BoP....the Romulans stealing Klingon designs again?  :P
139,UgzXWhBE1QXUAY-Wpqh4AaABAg.9Maf2LgaXQ29Ov08dnJXOj,UgzXWhBE1QXUAY-Wpqh4AaABAg,"@the party don't stop till I walk in possible....but I never saw the Romulans use anything that looked like a B'Rel or K'Vort class BoP on-screen though...closest I think they got to a design like that was the Valdore-class single hull warbirds in ""Nemesis"""
140,UgzXWhBE1QXUAY-Wpqh4AaABAg.9Maf2LgaXQ29OfsvQwjVrw,UgzXWhBE1QXUAY-Wpqh4AaABAg,"@Joseph Amendolea The Romulans also used Klingon D7 battlecruisers in the original series and IIRC, it was canon that the two cultures traded ships and technology between one another"
141,UgzXWhBE1QXUAY-Wpqh4AaABAg.9Maf2LgaXQ29OfZMiwHlv3,UgzXWhBE1QXUAY-Wpqh4AaABAg,@the party don't stop till I walk in I do remember that the Romulans had BoP's....original Enterprise fought them a few times in TOS...butthey always seemed to be smaller and just not very Klingon-esque in design
142,UgzXWhBE1QXUAY-Wpqh4AaABAg.9Maf2LgaXQ29OVFg6ltR-O,UgzXWhBE1QXUAY-Wpqh4AaABAg,"When Star Trek III: The Search For Spock was being produced, the Bird of Prey was originally supposed to be a Romulan vessel"
143,Ugz1YHaVIiXZQwCaphN4AaABAg,ooS0Hop_zhk,Klingons will destroy all of your gods!
144,UgwnD3C6gjX3888lJ3R4AaABAg,ooS0Hop_zhk,"I can see a lot of familiar Romulan ships but there's a couple that piques my interests, anyone can help clarify it? Btw the song is very catchy Volker! Great job on this fan-made marching song."
145,UgwnD3C6gjX3888lJ3R4AaABAg.9K59LgBIJgP9T2FDkeJL7w,UgwnD3C6gjX3888lJ3R4AaABAg,@Rammstein0963 Any specifics though?
146,UgwnD3C6gjX3888lJ3R4AaABAg.9K59LgBIJgP9T1exZkOjvQ,UgwnD3C6gjX3888lJ3R4AaABAg,Some of them are Star Trek online ships if that helps
147,UgwnD3C6gjX3888lJ3R4AaABAg.9K59LgBIJgP9QW19oF8pYU,UgwnD3C6gjX3888lJ3R4AaABAg,"@AlexRaccoonGlider I'm soooo sorry, but in this case, I can't help you, dear Alex."
148,UgwnD3C6gjX3888lJ3R4AaABAg.9K59LgBIJgP9QUX9Z2nLEd,UgwnD3C6gjX3888lJ3R4AaABAg,"@Volker400 I have to ask though, I recognized a majority of the Romulan ships save for a couple, do you know which ones are which, please?"
149,UgwnD3C6gjX3888lJ3R4AaABAg.9K59LgBIJgP9K6aJG3W8k9,UgwnD3C6gjX3888lJ3R4AaABAg,"Thanks so much, Alex, for your very fine comment. I appreciate it!!Best regards to you,Volker L. H. :)"
150,UgwUPGAlCgolR9acosR4AaABAg,ooS0Hop_zhk,I'm a saiyan
151,UgyQxTFFfqvNIkWz5914AaABAg,ooS0Hop_zhk,"The similarities between Earths Ancient Rome and Romulans is, I once heard, explained by the fact that both worlds (Earth and Romulus) were once visited by the same alien species we see in TOS episode featuring Apollo, who, along with others of their kind, once masqueraded as gods not just on Earth, but on several different planets in ancient times. This is why there is such similarities between Earth Mythology and Several Aliens in Star Trek. Including the name of the Klingon Home world Qo'noS, similar to the Ancient Greek ruler of the Underworld Cronus, before Hades. Additionally, Klingon Legend states that the Klingons Slew all their gods. Makes me wonder if that species who masqueraded as gods met their end by the Klingons on Qo'noS. All except Apollo of course."
152,UgyQxTFFfqvNIkWz5914AaABAg.9JFM5MJh89J9UqWij0pKjX,UgyQxTFFfqvNIkWz5914AaABAg,"A good theory, but the Romulans were a spacefaring race since their beginning, as they were rebels from Vulcan who did not accept Suraks teachings of Logic and went away to found their own realm. I doubt they would have been susceptible to such things as ""gods"". My theory is, as the Vulcans observed Earth since centuries and the schism between Vulcans and Romulans is about 2000 years ago, the Romulans were fascinated by Earth´s ancient Rome and adapted parts of that culture into their own."
153,UgyQxTFFfqvNIkWz5914AaABAg.9JFM5MJh89J9JFk7swA26b,UgyQxTFFfqvNIkWz5914AaABAg,"Very, very fine ccomment of yours, Pepper! I appreciate it very much!Many thanks to you, and the very best regards,Volker L. H. :)"
154,UgwT3fGwFdvzSD4PQrh4AaABAg,ooS0Hop_zhk,"I find it odd how the Remans are included even though their considered ""undesirable"" and a slave species. ""Glory to the Empire!"""
155,Ugz-squBdac_RbzBtDB4AaABAg,ooS0Hop_zhk,the triangular design in the middle of the bird logo for the Empire reminds me of a Stargate chevron LOL
156,UgzYGxyeNpbtbYtZhQR4AaABAg,ooS0Hop_zhk,Vulcans : Is this boss music i hear?Romulans and Remans: VESH TA'JOT!
157,Ugw9qo4kHwfMlk570294AaABAg,ooS0Hop_zhk,"Would you be able to compose anthem's for factions within ""Warhammer 40,000""? I would love to see your version of an anthem for the Imperium of Man."
158,Ugw9qo4kHwfMlk570294AaABAg.9EgaZ0V66D_9EhapBwGDLI,Ugw9qo4kHwfMlk570294AaABAg,I don't know. Thanks  for your question.
159,Ugyi3MSRzq6xOpABJNZ4AaABAg,ooS0Hop_zhk,This makes me feel like decloaking dead ahead of a Federation attack force and blowing em all up.
160,UgwyoTd7dDCJkeD8Xsl4AaABAg,ooS0Hop_zhk,ALL THOSE ROMULAN SHIPS MADE ME NUT
161,Ugzm7p9Sz6qAWJml3Rt4AaABAg,ooS0Hop_zhk,"Romulans, The Real Latin Roman-Catholics in out of our Planet, Terra!"
162,UgxNMJ_nsSoRGEmFwGp4AaABAg,ooS0Hop_zhk,Coronarium ! :))
163,UgxLBuUHpYG62iGUm2J4AaABAg,ooS0Hop_zhk,This is Rome when it conquers the stars!
164,UgxLBuUHpYG62iGUm2J4AaABAg.99gFJjRy6Sh9iWcgDUNSLT,UgxLBuUHpYG62iGUm2J4AaABAg,Yes
165,UgxLBuUHpYG62iGUm2J4AaABAg.99gFJjRy6Sh9iQatDajKWE,UgxLBuUHpYG62iGUm2J4AaABAg,"Romulans are evil like Klingons. They took over Earth. Get rid of the Star Trek species. Not Humans, ofc."
166,UgxLBuUHpYG62iGUm2J4AaABAg.99gFJjRy6Sh9bNgb2tPJwW,UgxLBuUHpYG62iGUm2J4AaABAg,"No, that would be the Terran empire from the mirror universe"
167,Ugy2zoaXKu5JqRw3vXR4AaABAg,ooS0Hop_zhk,Romulans need a TOP GUN theme emoji_smiling_face_with_sunglasses  MIGHTY RAPTORS  emoji_flexed_biceps 
168,UgzDwWxeU_-KAc5L3Wp4AaABAg,ooS0Hop_zhk,Long life the empire from a proud Romulanian and member of the Tal Shiar
169,UgzDwWxeU_-KAc5L3Wp4AaABAg.98sQzOcpGjq9bNglZc7SZY,UgzDwWxeU_-KAc5L3Wp4AaABAg,"General, you're a klingon, not a romulan"
170,UgzDwWxeU_-KAc5L3Wp4AaABAg.98sQzOcpGjq9BtUsKOWvMO,UgzDwWxeU_-KAc5L3Wp4AaABAg,Same
171,UgzDwWxeU_-KAc5L3Wp4AaABAg.98sQzOcpGjq9Azpfr-8ip3,UgzDwWxeU_-KAc5L3Wp4AaABAg,Well avatar got a hole lot more interesting
172,UgxeUzZhWxlP4tjk7y94AaABAg,ooS0Hop_zhk,ULTRA NATIONALISTIC EPICNESS!
173,UgwAXnw2ksYHdBJZJh54AaABAg,ooS0Hop_zhk,"Your content is great, love it."
174,UgwAXnw2ksYHdBJZJh54AaABAg.962Q_dy8F6g9638sA3WrI9,UgwAXnw2ksYHdBJZJh54AaABAg,"ThanX(XXL) so much, Daniel! So happy you enjoyed!Best regarads to you,Volker L. H. :)"
175,UgxwYY08XYNC9aKKWIl4AaABAg,ooS0Hop_zhk,We gonna vibe check vulcan -Sela
